"address","rank","reviewsDistribution/fiveStar","reviewsDistribution/fourStar","reviewsDistribution/oneStar","reviewsDistribution/threeStar","reviewsDistribution/twoStar","postalCode","street","reviewsCount","title","location/lat","location/lng","categoryName","price","totalScore"
"J7VP+X25, Kala Khatai Morr, Ali Park, Ferozewala, Lahore, Punjab, Pakistan","79","0","0","0","0","1",,"J7VP+X25, Kala Khatai Morr","1","Bella Sweets & Bakers","31.6448897","74.2851224","Bakery",,"2"
"95H7+WP5, Superior Services Housing Society, Lahore, Punjab, Pakistan","60","0","0","1","0","0",,"95H7+WP5","1","Mr. Chipps Fries, Roll, Samosas","31.3797524","74.1643652","Bakery",,"1"
"J8H4+CFC Ilamdin colony, Qaiser Town-Shahdara Town Rd, Shahdara Town, Shahdara, Lahore, Punjab, Pakistan","80",,,,,,,"J8H4+CFC Ilamdin colony, Qaiser Town-Shahdara Town Rd","0","Naveed karyana store","31.6285503","74.3061313","Bakery",,
"J6CJ+VHC, Kot Abdul Malik, Sheikhupura, Punjab, Pakistan","81",,,,,,,"J6CJ+VHC","0","Bismillah Burger 🍔 And Shwarma point","31.6221999","74.231381","Bakery",,
"J6CM+5P4, Kot Abdul Malik, khurd, Punjab, Pakistan","82",,,,,,,"J6CM+5P4","0","Rizwan Nan Shop","31.6203805","74.2343305","Bakery",,
"79 AA GF Commercial Palazanear Beacon HouseSector D, Aa Block Sector D Bahria Town, Lahore, Punjab 53720, Pakistan","61","1","1","1","0","0","53720","79 AA GF Commercial Palazanear Beacon HouseSector D","3","Saim Naan Shop","31.3736449","74.1713157","Bakery",,"3.3"
"J7CJ+CWH, Shahdara Town, Shahdara, Lahore, Punjab, Pakistan","83",,,,,,,"J7CJ+CWH","0","Al Yousaf Tuck shop","31.6210671","74.2823724","Bakery",,
"966M+9QC, Chanar Courts, Lahore, Punjab, Pakistan","62",,,,,,,"966M+9QC","0","Rahat baker","31.3609372","74.23448","Bakery",,
"956P+JC6, Sector E Bahria Town, Lahore, Punjab, Pakistan","63","287","147","40","38","16",,"956P+JC6","528","Jalal Sons","31.3615487","74.1860276","Grocery store",,"4.2"
"M78G+X93, Shah Khalid Town Rd, Feroz Wala, Ferozewala, Sheikhupura, Punjab, Pakistan","84",,,,,,,"M78G+X93, Shah Khalid Town Rd","0","HABIB SWEETS AND GENERAL STORE","31.6673752","74.2759104","Bakery",,
"Arriyan Raiwind Rd, Kot Araian, Lahore, Punjab, Pakistan","64",,,,,,,"Arriyan Raiwind Rd","0","Shar e Rabbani sweet & bakers","31.3392026","74.2372282","Bakery",,
"Ground Floor, Nishter Block, Plaza No. 11, opposite Al Fateh, Sector E Commercial Area Bahria Town, Lahore, 53720, Pakistan","65","1","0","1","1","0","53720","Ground Floor, Nishter Block, Plaza No. 11, opposite Al Fateh","3","Eminabadi Barfi ایمن آبادی برفی","31.3611486","74.1868674","Bakery",,"3"
"J8H2+XJ7, Shahdara Town, Shahdara, Lahore, Punjab, Pakistan","85","1","0","1","0","0",,"J8H2+XJ7","2","Waheed jazal store","31.629912","74.3015449","Bakery",,"3"
"85Q3+6Q, Haweliyan Gujran Village, Lahore, Punjab, Pakistan","66",,,,,,,"85Q3+6Q","0","Arham bakes. Way","31.338036","74.154498","Bakery",,
"952C+28H, near cenima, secret F Bahria Town, Lahore, Punjab, Pakistan","67",,,,,,,"952C+28H, near cenima","0","Ghosia milk & sweets","31.3499574","74.1708855","Bakery",,
"J7WM+WGX GT Rd, Imamia Colony, Shahdara, Imamia Colony Rd, Lahore, Punjab 54950, Pakistan","86",,,,,,"54950","J7WM+WGX GT Rd, Imamia Colony, Shahdara, Imamia Colony Rd","0","Golden Pizza Burger","31.6473447","74.2838421","Bakery",,
"17km Raiwind Rd, Kot Araian, Lahore, Punjab, Pakistan","68","0","1","0","0","0",,"17km Raiwind Rd","1","Golgappa and Dahi bhalla house","31.3348841","74.2357802","Bakery",,"4"
"J79Q+VVJ, Saeed Park Shahdara Town, Shahdara, Lahore, Punjab 54950, Pakistan","87",,,,,,"54950","J79Q+VVJ","0","Discover Yourself","31.6197048","74.2896384","Cookie shop",,
"grand mosque btl, e, Lavandus Block Bahria Town, Lahore, Punjab 53720, Pakistan","69",,,,,,"53720","grand mosque btl, e","0","DOUGH DELIGHTS","31.362808","74.1864427","Bakery",,
"J7RP+G4F, Barkat Town Stop, Link Rd, Shahdara Town, Shahdara, Lahore, Punjab, Pakistan","88",,,,,,,"J7RP+G4F, Barkat Town Stop, Link Rd","0","LAHORE SWEET & BAKER","31.641306","74.285298","Bakery",,
"Plaza# 62, adj. DRUGSHOP, near Grand Mosque, Sector C Commercial Area Sector C Bahria Town, Lahore, Punjab 53720, Pakistan","70",,,,,,"53720","Plaza# 62, adj. DRUGSHOP, near Grand Mosque","0","Layers","31.3703596","74.1857102","Bakery",,
"J6P5+92W, Jinnah Avenue،, Gulfishan Town, Sheikhupura, Punjab, Pakistan","89","0","1","0","0","0",,"J6P5+92W, Jinnah Avenue،","1","Food Corner","31.6359858","74.2075892","Bakery",,"4"
"959G+QPR, Sector C Janiper Block Sector C Bahria Town, Lahore, Punjab, Pakistan","71",,,,,,,"959G+QPR","0","Shan haider","31.369487","74.1767673","Bakery",,
"R-239, R block Lahore-Islamabad Mtwy, city, Sheikhupura, Punjab, Pakistan","90",,,,,,,"R-239, R block Lahore-Islamabad Mtwy","0","Bismillah Abbasi Naan Shop","31.6410371","74.2176189","Bakery",,
"Nishtar Commercial Plaza No. 6 near clock tower Sector E bahria, town, Lahore, Pakistan","72","250","72","28","32","8",,"Nishtar Commercial Plaza No. 6 near clock tower Sector E bahria","390","Coffee Planet & Italian Pizzeria - Bahria Town","31.3617693","74.1867841","Restaurant",,"4.3"
"J7HQ+6HQ, Lahore Rd, Shahdara Town, Shahdara, Lahore, Punjab, Pakistan","91",,,,,,,"J7HQ+6HQ, Lahore Rd","0","طارق ٹریڈر","31.6280267","74.2888383","Bakery",,
"Shiekh Kot, near Eiffel Tower, Bahria Town, Lahore, Punjab, Pakistan","73","1","0","1","0","0",,"Shiekh Kot, near Eiffel Tower","2","Choice corner dahi bhalla and cream cart","31.3531517","74.1866217","Bakery",,"3"
"sardar market islam nagar canal Road Lahore LAHORE (L033, 53801, Pakistan","74",,,,,,"53801","sardar market islam nagar canal Road Lahore LAHORE (L033","0","Rasheed Karyana Shop","31.3594784","74.1474322","Bakery",,
"M865+8JQ, Haji Kot Sheikhupura, Punjab, Pakistan","92",,,,,,,"M865+8JQ","0","Dory Sweets & Bakers","31.6608321","74.3091076","Bakery",,
"Main Bazar Rachna Disposable Road St # 31 Shadra, Qazi Park Shahdara Town, Lahore, Punjab 51214, Pakistan","93",,,,,,"51214","Main Bazar Rachna Disposable Road St # 31 Shadra","0","Arham Sweets & Bakers","31.6250928","74.2956899","Bakery",,
"95GJ+GM4, Sector C Gulmahar Block Sector C Bahria Town, Lahore, Punjab, Pakistan","75",,,,,,,"95GJ+GM4","0","SM Mart & Bakery","31.3763125","74.1816875","Grocery store",,
"M75J+FP3, GT Rd, Rachna Town Lahore, Punjab 54000, Pakistan","94","0","0","1","0","0","54000","M75J+FP3, GT Rd","1","sher e rabbani bakers","31.6586463","74.2817835","Bakery",,"1"
"F7WC+C63, Main St, Ghani Colony Commercial Area Sector C Education Town, Lahore, Punjab, Pakistan","76",,,,,,,"F7WC+C63, Main St","0","Education town","31.3752066","74.1855993","Bakery",,
"J7JM+FJM Javaid iqbal chohan abdul ghani chouhan, GT Rd, Shahdara Town, Lahore, Punjab, Pakistan","95",,,,,,,"J7JM+FJM Javaid iqbal chohan abdul ghani chouhan, GT Rd","0","Pizza And Russian Salad By Chef Syed Abdul Rehman Shah","31.6312103","74.2840556","Bakery",,
"95GP+PQM, Sector C Commercial Area Sector C Bahria Town, Lahore, Punjab 53720, Pakistan","77",,,,,,"53720","95GP+PQM","0","Bahria","31.3768403","74.1869211","Bakery",,
"68 Main Bazar Rd, Shahdara Town, Shahdara, Lahore, Punjab, Pakistan","96",,,,,,,"68 Main Bazar Rd","0","Fouji Bakers","31.6274159","74.3085736","Bakery",,
"J7FW+F7Q, Qazi Park Shahdara Town, Lahore, Punjab, Pakistan","97",,,,,,,"J7FW+F7Q","0","Meher sweets","31.6237042","74.2957478","Bakery",,
"Road, Jati Umrah Block D Awt Housing Scheme Phase 2 AWT Phase 2, Lahore, Punjab 55150, Pakistan","78",,,,,,"55150","Road","0","Cravery by Saria","31.3515568","74.2127833","Bakery",,
"M77Q+5R2, Sikandarabad, Lahore, Punjab, Pakistan","98",,,,,,,"M77Q+5R2","0","Ahmad traders","31.6628936","74.2895224","Bakery",,
"5 Kot Araian - Jia Bagga Rd, Kot Araian, Lahore, Punjab 55151, Pakistan","79",,,,,,"55151","5 Kot Araian - Jia Bagga Rd","0","Sandhu mobile and Cold corner","31.3361133","74.24194","Bakery",,
"J7JM+36C, Sui Gas Rd, Shahdara Town, Lahore, Punjab, Pakistan","99",,,,,,,"J7JM+36C, Sui Gas Rd","0","Passenger","31.63023","74.2829908","Bakery",,
"R6G7+5R5, Kul, Kasur, Punjab, Pakistan","1",,,,,,,"R6G7+5R5","0","لہرا بہرہ فوڈز","30.8253946","74.2146119","Bakery",,
"V6WP+WV6, Usmanwala, Kasur, Punjab, Pakistan","4",,,,,,,"V6WP+WV6","4","Ayub Bakery","30.8972923","74.2371384","Bakery",,"3.5"
"J8G2+XX4، Jhalaran Road, Shahdara Town, Lahore, Punjab, Pakistan","100",,,,,,,"J8G2+XX4، Jhalaran Road","0","Sheikh Samosa's Rolls","31.627381","74.302421","Bakery",,
"Q449+WWP, Kanganpur, Kasur, Punjab, Pakistan","11",,,,,,,"Q449+WWP","1","Rahmat Bakary","30.7573843","74.1197552","Bakery",,"5"
"W45M+C7G, Depalpur Rd, Talwandi, Kasur, Punjab, Pakistan","16",,,,,,,"W45M+C7G, Depalpur Rd","13","Nasir Bakers","30.9085549","74.1331945","Bakery",,"3.3"
"HMVV+QF6, Manan Wala, Sheikhupura, Punjab, Pakistan","3",,,,,,,"HMVV+QF6","1","SAIF TRADERS ANS BAKERS","31.5944014","73.6936316","Bakery",,"5"
"Ahmad travel, Qasurpura, Lahore, Punjab 54000, Pakistan","19",,,,,,"54000","Ahmad travel","4","Ahmad sweets and Toys","31.600362","74.297782","Bakery",,"5"
"4CJX+RX7, Chonk, Qadirabad, Kasur, Punjab, Pakistan","20",,,,,,,"4CJX+RX7, Chonk","418","Gourmet Foods","31.1317032","74.4499948","Bakery",,"4"
"J7MH+7RH, Wandala Rd, Main Bazar Shahdara Town, Shahdara, Lahore, Punjab, Pakistan","101",,,,,,,"J7MH+7RH, Wandala Rd","0","Mian Bakers","31.6331759","74.2796234","Bakery",,
"main plaza, Rachna Town Lahore, Punjab 40050, Pakistan","102",,,,,,"40050","main plaza","0","Shhabaz dahi bhaly and fruit chaat","31.6585747","74.2813633","Bakery",,
"Shop No 1, KD Plaza, 100 MM Alam Rd, near Zoom Petrol Pump, Block B2 Block B 2 Gulberg III, Lahore, Punjab, Pakistan","20",,,,,,,"Shop No 1, KD Plaza, 100 MM Alam Rd, near Zoom Petrol Pump","3207","Layers Bakeshop - MM Alam","31.5097637","74.3506717","Bakery","$$","4.6"
"J6CQ+62M, Kot Abdul Malik, Sheikhupura, Punjab, Pakistan","103","0","0","0","0","1",,"J6CQ+62M","1","Jhule lal milk shop","31.620594","74.2375341","Bakery",,"2"
"بھٹہ خشت, Sheikhupura, Punjab, Pakistan","104",,,,,,,"بھٹہ خشت","0","Rahim jeneral store","31.6465903","74.2535132","Bakery",,
"Shahdara, road Barkat Town Rd, Kala Kahti, Lahore, 54000, Pakistan","105",,,,,,"54000","Shahdara, road Barkat Town Rd","0","Hanif Dahi Bahly","31.6444793","74.2880338","Bakery",,
"M75C+854, Feroz Wala, Ferozewala, Sheikhupura, Punjab, Pakistan","106",,,,,,,"M75C+854","0","Haji Store","31.6591701","74.2703955","Bakery",,
"10 Lajpat Rd, Shahdara Town, Shahdara, Lahore, Punjab, Pakistan","107",,,,,,,"10 Lajpat Rd","0","M.ABBAS ATTA CHAKI","31.6282433","74.2817","Bakery",,
"J6M7+MCJ, Gulfishan Town, Lahore, Sheikhupura, Punjab, Pakistan","108",,,,,,,"J6M7+MCJ","0","Chitta Naan Shop","31.6342154","74.2135122","Bakery",,
"M759+9H3, Peoples Colony Feroz Wala, Ferozewala, Sheikhupura, Punjab, Pakistan","109",,,,,,,"M759+9H3","0","DD STORE","31.6583881","74.2689249","Bakery",,
"J7RF+G67, Wandala Rd, Shahdara Town, Lahore, Punjab, Pakistan","110",,,,,,,"J7RF+G67, Wandala Rd","0","Aliya pan shop","31.6412848","74.2730494","Bakery",,
"M73G+983, Peoples Colony Shahdara, Lahore, Punjab, Pakistan","111",,,,,,,"M73G+983","0","Mian cold corner 001","31.6533824","74.2757525","Bakery",,
"Shop-2, opposite Dory Bakery, near Sangheet cenima, Qazi Park Shahdara Town, Lahore, Punjab 54000, Pakistan","112",,,,,,"54000","Shop-2, opposite Dory Bakery, near Sangheet cenima","0","Servaid Pharmacy","31.6232132","74.294746","Pharmacy",,
"14 - D3 Main Boulevard, near Lani's Kitchen, WAPDA Town Block D 3 Wapda Town Phase 1 Lahore, Punjab 54770, Pakistan","7",,,,,,"54770","14 - D3 Main Boulevard, near Lani's Kitchen","15","Sialkot Sweets and Bakers Wapda Town Branch","31.4394144","74.2729713","Bakery",,"4.7"
"H7RX+7F8, Karim Park Lahore, Punjab 54000, Pakistan","1",,,,,,"54000","H7RX+7F8","762","Golden Bakery","31.5904746","74.2997759","Bakery",,"4.2"
"120 Street 5, Block E1 Block E 1 Wapda Town Phase 1 Lahore, Punjab, Pakistan","14",,,,,,,"120 Street 5","904","Bundu Khan Sweets & Bakers - Wapda Town","31.4368246","74.2707448","Bakery","$$","4.3"
"H8PP+4VX, Akbar Shaheed Rd, opposite Chugtai Lab, Misri Shah, Lahore, Punjab, Pakistan","9",,,,,,,"H8PP+4VX, Akbar Shaheed Rd, opposite Chugtai Lab","101","Bay Bakery","31.5853153","74.3371013","Bakery",,"4.4"
"Karim Park Lahore, Punjab 54000, Pakistan","12",,,,,,"54000",,"886","Bundu Khan Sweets & Bakers","31.5912755","74.3014094","Bakery","$$","4.4"
"Gourmet Bakers, Defence Rd, Block A Dha Rahbar Phase 1 Dha Rahbar, Lahore, Punjab 54700, Pakistan","15",,,,,,"54700","Gourmet Bakers, Defence Rd","1312","Gourmet Foods - Rahbar Dha","31.390533","74.2473097","Bakery",,"4"
"Railway Plaza, Allama Iqbal Rd, Garhi Shahu, Lahore, Punjab, Pakistan","14",,,,,,,"Railway Plaza, Allama Iqbal Rd","1105","Gourmet Foods","31.5647222","74.3447222","Bakery",,"3.9"
"51 NE, NFC, 1 Phase, Commercial Zone NFC Society, Lahore, Punjab 54000, Pakistan","17",,,,,,"54000","51 NE, NFC, 1 Phase","23","TEHWAR Bakers | Sweets","31.4154899","74.2684522","Bakery",,"4.6"
"77 Nisbat Rd, Gawalmandi, Lahore, Punjab 54000, Pakistan","15",,,,,,"54000","77 Nisbat Rd","664","Gourmet Foods","31.569168","74.3215858","Bakery",,"3.9"
"Chashma Rd, Block K1 Block K 1 Wapda Town Phase 1 Lahore, Punjab, Pakistan","18",,,,,,,"Chashma Rd","334","Cakes & Bakes","31.4199479","74.2657049","Bakery","$$","4.2"
"H7XX+F96, Ravi Rd, Qasurpura, Lahore, Punjab, Pakistan","16",,,,,,,"H7XX+F96, Ravi Rd","357","Malmo Bakers & Sweets","31.5986703","74.2983864","Bakery","$$","4.1"
"4-D Main Commercial،, D Block Block D Valencia, Lahore, Punjab, Pakistan","19",,,,,,,"4-D Main Commercial،","87","Butt Sweet & Bakers","31.4093737","74.2600194","Bakery",,"3.4"
"Aslam arcade, 16 McLoed Road, Lakshmi Chowk, 16 McLeod Rd, Garhi Shahu, Lahore, Punjab 54000, Pakistan","18",,,,,,"54000","Aslam arcade, 16 McLoed Road, Lakshmi Chowk, 16 McLeod Rd","2952","Butt Sweets & Bakers","31.5672749","74.3234283","Bakery","$$","4.2"
"Siddiqia Colony Badami Bagh, Lahore, Punjab, Pakistan","20",,,,,,,,"316","Chiragh Din Sweets & Bakers","31.6037617","74.329231","Bakery",,"4.3"
"4. E, Block E Audit and Accounts Housing Society, Lahore, Punjab 42000, Pakistan","40","143","49","12","33","8","42000","4. E","245","Malva Bakers & Sweets Audit Accounts","31.4017271","74.2688148","Bakery",,"4.2"
"H97R+W8V, Nabi Pura, Lahore, Punjab, Pakistan","27","669","259","101","234","83",,"H97R+W8V","1346","Gourmet Foods","31.5648613","74.3908122","Bakery","$$","4"
"2 regal chowk, Main Hall Rd, Lahore, 54000, Pakistan","37","54","16","4","3","0","54000","2 regal chowk, Main Hall Rd","77","TARIQ Sweets & Bakes","31.5622083","74.3194054","Bakery",,"4.5"
"HXQ9+PWR, Kalia, Sheikhupura, Punjab, Pakistan","1",,,,,,,"HXQ9+PWR","0","Abu Bakkar","31.5893622","73.9697799","Bakery",,
"H3H4+RC7, Unnamed Road, Chak # 10, Sheikhupura, Punjab, Pakistan","6",,,,,,,"H3H4+RC7, Unnamed Road","1","بابر سموسہ پوائنٹ Babar Food point","31.5795362","74.0560556","Bakery",,"5"
"واپڈا ایوینیو, WAPDA Town Block E 1 Wapda Town Phase 1 Lahore, Punjab, Pakistan","41","1037","649","68","300","71",,"واپڈا ایوینیو","2125","Cakes & Bakes","31.437389","74.2713952","Bakery","$$","4.2"
"97Q4+64P, Akram Rd, Block E Dha Rahbar Phase 1 Dha Rahbar, Lahore, Punjab, Pakistan","42","13","0","0","0","0",,"97Q4+64P, Akram Rd","13","Baji baker","31.3880891","74.2553184","Bakery",,"5"
"Usmania Tower, Rehmat Chowk, Block A 1 Valencia, Lahore, Punjab, Pakistan","46","125","90","14","41","9",,"Usmania Tower, Rehmat Chowk","279","Malmo Bakers & Sweets","31.4193125","74.2658125","Bakery","$$","4.1"
"4-A Commercial, Raiwind Rd, Block B Lda Avenue Phase 1 Sher Shah Colony, Lahore, Punjab, Pakistan","47","225","79","26","87","22",,"4-A Commercial, Raiwind Rd","439","Fazal Sweets And Bakers","31.4139453","74.2251209","Bakery","$$","4"
"C67F+HR9, Block A, Sher Shah Colony, Raiwind Rd, near Eden Lane Villas, Block A I, Lahore, Punjab, Pakistan","49","450","142","23","85","20",,"C67F+HR9, Block A, Sher Shah Colony, Raiwind Rd, near Eden Lane Villas","720","Jawa Sweets & Bakers, Fooding","31.4139061","74.2246148","Bakery","$$","4.4"
"Plot 230, phase 1 Nasheman Iqbal Phase 1 Nasheman-e-Iqbal Housing Society, Lahore, Punjab, Pakistan","50","6","8","3","1","3",,"Plot 230","21","Ustun Bakers and Sweets","31.4336929","74.251357","Bakery",,"3.5"
"105-Shalimar Link Rd, Mujhadabad, Shalamar Town, Lahore, Punjab 54000, Pakistan","42","333","133","34","106","25","54000","105-Shalimar Link Rd, Mujhadabad","631","Barkat Bakers","31.5682855","74.3810675","Bakery","$$","4.1"
"85, D, DHA EME Sector, Lahore, 54000, Pakistan","54","6","0","0","0","1","54000","85, D","7","Kyoot","31.4356156","74.2134852","Novelty store",,"4.6"
"Lal Khoo Bazar, Kucha Chagtah Walled City of Lahore, Lahore, Punjab 54000, Pakistan","43","283","77","7","25","9","54000","Lal Khoo Bazar","401","Rafiq Sweet House","31.5780976","74.3221007","Bakery","$","4.5"
"H8WX+QR7, Sher Shah Rd, Scheme No. 2 Scheme No 2, Lahore, Punjab, Pakistan","46","270","77","26","45","16",,"H8WX+QR7, Sher Shah Rd","434","Jawed Sweets","31.5969104","74.3495344","Bakery",,"4.3"
"1 KM Defense Road Chowk Raiwind Road near Lahore, Bhobtian, University،, Lahore, Punjab 54000, Pakistan","55","130","48","17","32","11","54000","1 KM Defense Road Chowk Raiwind Road near Lahore","238","Gourmet Foods Head Office","31.3943878","74.2383579","Corporate office",,"4.1"
"H8PR+W3F, Chah Miran Rd, Chah Miran, Lahore, Punjab, Pakistan","49","168","87","24","54","26",,"H8PR+W3F, Chah Miran Rd","359","Gourmet Foods","31.587319","74.3401822","Bakery","$$","4"
"96W7+R25, Defence Rd, Lahore, Punjab, Pakistan","56","11","4","1","0","1",,"96W7+R25, Defence Rd","17","Malmo Foods (Pvt.) Limited","31.3970228","74.2125993","Corporate office",,"4.4"
"96X6+4RR, Defence Rd, Lda Avenue Phase 1 Lda Avenue, Lahore, Punjab, Pakistan","57","31","11","0","6","2",,"96X6+4RR, Defence Rd","50","Premier dairies","31.3978699","74.2120306","Corporate office",,"4.4"
"H8H7+V73, Lohari Mandi Bazaar, Kucha Baili Ram Walled City of Lahore, Lahore, Punjab 54000, Pakistan","50","18","2","1","5","0","54000","H8H7+V73, Lohari Mandi Bazaar","26","Bissmillah Bakery","31.5796454","74.3131811","Bakery",,"4.4"
"H8MW+6XV Swami Nagar, Schazoo Housing Society Swami Nagar, Lahore, Punjab, Pakistan","51","204","60","25","65","25",,"H8MW+6XV Swami Nagar","379","High Class Sweets and Bakers","31.5831242","74.3474372","Bakery","$","4"
"C67H+PW7, Raiwind Rd, near LDA Avenue-1, Bilal Town Block B Lda Avenue Phase 1 B Block, Lahore, Punjab, Pakistan","58",,,,,,,"C67H+PW7, Raiwind Rd, near LDA Avenue-1","0","Noshahi General Store","31.4142779","74.2297912","General store",,
"30 G. T. Road, Lahore 54000 GT Rd, Singhpura, Lahore, Punjab 54000, Pakistan","52","540","209","41","105","22","54000","30 G. T. Road, Lahore 54000 GT Rd","917","Bundu Khan Sweets & Bakers - Shalimar","31.5829831","74.3788647","Bakery","$$","4.3"
"2 Shalimar Link Road, Sahowari Ramgarh, Lahore, Punjab 54000, Pakistan","55","361","178","33","96","26","54000","2 Shalimar Link Road","694","Malmo Bakers & Sweets","31.5756802","74.3812877","Bakery","$$","4.2"
"H9H9+QFR, GT Rd, Baghbanpura, Lahore, Punjab 54000, Pakistan","56","78","33","9","14","2","54000","H9H9+QFR, GT Rd","136","Cakes & Bakes","31.5789994","74.3688958","Bakery","$$","4.2"
"86 Allama Iqbal Rd, Garhi Shahu, Lahore, Punjab 54000, Pakistan","57","321","153","20","72","13","54000","86 Allama Iqbal Rd","579","Cakes & Bakes","31.5615333","74.3479426","Bakery","$$","4.3"
"H8HX+G26, Swami Nagar Rd, Tezab Ahata Swami Nagar, Lahore, Punjab, Pakistan","59","394","146","27","76","19",,"H8HX+G26, Swami Nagar Rd","662","Cakes & Bakes","31.5789413","74.347695","Bakery","$$","4.3"
"H78R+877, Abdali Rd, Krishan Nagar Islampura, Lahore, Punjab 54000, Pakistan","60","303","145","52","133","45","54000","H78R+877, Abdali Rd","678","Gourmet Foods","31.5657943","74.2906763","Bakery","$$","3.9"
"3FV2+QX6, Adda Dollay Wala, Kasur, Punjab, Pakistan","1",,,,,,,"3FV2+QX6","4","Mehar Asif Bakery","31.0944004","74.4523944","Bakery",,"5"
"3CQ8+C7Q, Nizam Pura, Kasur, Punjab, Pakistan","4",,,,,,,"3CQ8+C7Q","1","Mehar Bakery & General Store","31.0885809","74.4157448","Bakery",,"5"
"4C4W+XR3, Kasur, Punjab, Pakistan","7",,,,,,,"4C4W+XR3","21","Al Sadeeq Bekars","31.1073806","74.4470434","Bakery",,"3.5"
"4C7Q+3PM, Chiragh Shah Rd, Kasur, Punjab, Pakistan","9",,,,,,,"4C7Q+3PM, Chiragh Shah Rd","18","Al Khalil Sweets & Bakers","31.1127049","74.4393092","Bakery","$","4.3"
"4FC5+Q5V, Shahbaz Khan Rd, Tariq Colony Kasur, Punjab, Pakistan","17",,,,,,,"4FC5+Q5V, Shahbaz Khan Rd","213","Nirala Sweets & Bakers","31.1219814","74.4579309","Bakery","$$","3.7"
"J78G+F22, Sheikhpura Road Opp. Rustam Sohrab Factory Shahdara, Lahore-Sargodha Rd, Shahdara, Shahdara Town, Lahore, Punjab, Pakistan","61","206","110","49","75","26",,"J78G+F22, Sheikhpura Road Opp. Rustam Sohrab Factory Shahdara, Lahore-Sargodha Rd, Shahdara","466","Butt Sweet","31.616141","74.2750199","Candy store","$$","3.9"
"5a Lower Mall, Rewaz Garden Rewaz Gardens, Lahore, Punjab 54000, Pakistan","62","167","73","16","38","6","54000","5a Lower Mall","300","Jalal Sons - Rewaz Garden","31.5609363","74.3047626","Bakery","$$","4.2"
"Primark Shopping Mall, MM Alam Rd, Block P Gulberg 2, Lahore, Punjab 54000, Pakistan","3",,,,,,"54000","Primark Shopping Mall, MM Alam Rd","2124","Baba Bakers & Sweets","31.5220031","74.3505855","Bakery","$$","4.3"
"Ground Floor, Shop # 1 Plaza, 11, Hunza Block Allama Iqbal Town, Lahore, Pakistan","4",,,,,,,"Ground Floor, Shop # 1 Plaza, 11","2367","Layers Bakeshop - Allama Iqbal Town","31.5133896","74.297764","Bakery","$$","4.5"
"Shop No 3 ground floor 60 C/3 Chaudhry, Zahoor Elahi Rd, Lahore, 54660, Pakistan","6",,,,,,"54660","Shop No 3 ground floor 60 C/3 Chaudhry, Zahoor Elahi Rd","930","Layers Bakeshop - Zahoor Elahi Road","31.5255629","74.3346002","Bakery","$$","4.5"
"E-165, Street 1, Sultan Park Lahore Cantt, Pakistan, Lahore, 54000, Pakistan","7",,,,,,"54000","E-165, Street 1, Sultan Park Lahore Cantt, Pakistan","90","Designer Customize Cakes in Lahore","31.5203906","74.3588167","Cake shop",,"4.4"
"H8MX+723, Swami Nagar Lahore, Punjab, Pakistan","63","249","103","18","55","22",,"H8MX+723","447","Java Sweets And Bakers","31.583129","74.3475444","Bakery","$$","4.2"
"276 A-Block، New Muslim Town, Block A Muslim Town, Lahore, Punjab, Pakistan","9",,,,,,,"276 A-Block، New Muslim Town","84","Nemo's Bakery","31.510235","74.314231","Bakery",,"4.3"
"15 1/A Wahdat Rd, near Ab para Market stop, Rehmanpura Colony, Lahore, Punjab 54000, Pakistan","10",,,,,,"54000","15 1/A Wahdat Rd, near Ab para Market stop","1072","Bread & Beyond - Wahdat Road","31.5201968","74.3209199","Bakery",,"4.3"
"Durand Rd, Garhi Shahu, Lahore, Punjab, Pakistan","64","273","119","25","82","23",,"Durand Rd","522","Cakes & Bakes (Franchise)","31.5615363","74.3372459","Bakery","$$","4.1"
"Araf chock, Hassan Din St, near umar grammar school, Ittehad Colony, Lahore, Punjab 54500, Pakistan","11",,,,,,"54500","Araf chock, Hassan Din St, near umar grammar school","22","Cakes Party","31.5273612","74.2942282","Bakery",,"5"
"Abdali Road, Haider Rd, Krishan Nagar Islampura, Lahore, Pakistan","65","403","157","20","71","25",,"Abdali Road, Haider Rd","676","Cakes & Bakes","31.5677665","74.2919726","Bakery","$$","4.3"
"18b Wahdat Rd, opposite Abrar center, Muslim Town, Lahore, Punjab 54600, Pakistan","13",,,,,,"54600","18b Wahdat Rd, opposite Abrar center","1534","Good Luck Bakers & Sweets","31.5184749","74.3192299","Bakery",,"4.3"
"H77Q+FCQ, 2 Sanda Rd, Krishan Nagar Lahore, Punjab 54000, Pakistan","66","654","224","51","118","24","54000","H77Q+FCQ, 2 Sanda Rd","1071","Bundu Khan Sweets & Bakers - Sanda","31.5636652","74.2903809","Bakery","$$","4.3"
"First Roundabout، Samanabad, Lahore, 54000, Pakistan","15",,,,,,"54000","First Roundabout، Samanabad","2847","Cakes & Bakes","31.5417534","74.3018279","Bakery","$$","4.3"
"McLeod Rd, Qila Gujjar Singh, Lahore, Punjab 54000, Pakistan","67","63","13","2","13","2","54000","McLeod Rd","93","Cakes & Bakes","31.5695609","74.3290018","Bakery","$$","4.4"
"Road, Main Market, Lahore, Punjab, Pakistan","16",,,,,,,"Road","61","Shezan Bakers","31.5245625","74.3455625","Bakery",,"4.1"
"Allama Iqbal Rd, Garhi Shahu, Lahore, Punjab 54000, Pakistan","68","76","33","12","18","5","54000","Allama Iqbal Rd","144","New Butt Bakers","31.5632327","74.3458148","Bakery",,"4.1"
"The Loaf, 139 E-1 Shahrah-e-Hazrat Imam Hussain, Gulberg III, Lahore, 54660, Pakistan","17",,,,,,"54660","The Loaf, 139 E-1 Shahrah-e-Hazrat Imam Hussain","20","The Loaf Microbakery","31.5158668","74.3353497","Bakery",,"4.5"
"House no. 8, St no. 24, near Ghani Masjid, Sant Nagar St Nagar, Lahore, Punjab 54000, Pakistan","69","1","0","1","0","0","54000","House no. 8, St no. 24, near Ghani Masjid","2","H&M HomeBaker","31.5723147","74.295691","Bakery",,"3"
"H8PP+RVW, Chowk Nakhuda, Lahore, Punjab, Chah Miran Rd, Chah Miran, Lahore, Punjab, Pakistan","70","300","99","40","92","27",,"H8PP+RVW, Chowk Nakhuda, Lahore, Punjab, Chah Miran Rd","558","Butt Sweets","31.5871071","74.3372076","Bakery","$$","4.1"
"H833+6GH, Chauburji Quarters Block B New Chauburji Park, Lahore, Punjab 54000, Pakistan","18",,,,,,"54000","H833+6GH","185","Bundu Khan Sweets & Bakers","31.5530621","74.3038708","Bakery",,"4.4"
"H76X+P42، ساندہ روڈ, Rajgarh, Lahore, Punjab 54000, Pakistan","71","203","90","18","67","10","54000","H76X+P42، ساندہ روڈ","388","Butt Sweets & Bakers","31.5617715","74.2977758","Bakery","$$","4.2"
"4 Main Boulevard, Chenab Block Allama Iqbal Town, Lahore, Punjab 54000, Pakistan","19",,,,,,"54000","4 Main Boulevard","1116","Bundu Khan Sweets & Bakers - Iqbal Town","31.5174923","74.2937514","Bakery",,"4.3"
"H9XH+CVP, Bhogiwal Rd, shaller chowk Baghbanpura, Lahore, Punjab, Pakistan","72","30","5","9","1","1",,"H9XH+CVP, Bhogiwal Rd","46","Lasani Bakers n Sweets","31.5985964","74.3797162","Candy store",,"4"
