"address","rank","reviewsDistribution/fiveStar","reviewsDistribution/fourStar","reviewsDistribution/oneStar","reviewsDistribution/threeStar","reviewsDistribution/twoStar","postalCode","street","reviewsCount","title","location/lat","location/lng","categoryName","price","totalScore"
"F6PP+GJM, Niazbeg Rd, Thoker Niaz Baig, Lahore, Punjab, Pakistan","94",,,,,,,"F6PP+GJM, Niazbeg Rd","0","Hussaini bakery","31.4863281","74.2365456","Bakery",,
"C7W5+HJC, Jan Muhammad Road, Al-Hamra Town Al Hamra Town, Lahore, Punjab, Pakistan","95","104","34","22","26","10",,"C7W5+HJC, Jan Muhammad Road","196","Al-Jannat Store - الجنت سٹور","31.4464295","74.25901","Grocery store",,"4"
"Ahmedpur, Circular Rd, Sangla Hill, Punjab, Pakistan","4",,,,,,,"Ahmedpur, Circular Rd","191","Gourmet Bakers & Sweets","31.7135625","73.3740625","Bakery",,"3.7"
"2G5P+VXW, Narowal - Muridke Rd, Kot Abdullah, Sheikhupura, Punjab, Pakistan","1",,,,,,,"2G5P+VXW, Narowal - Muridke Rd","0","Jutt sweets&Bakers","32.0097998","74.537512","Bakery",,
"Plot 98, Block B PCSIR Staff Colony, Lahore, Punjab 54000, Pakistan","2",,,,,,"54000","Plot 98","168","Cakes & Bakes","31.4319501","74.2887432","Bakery","$$","4.2"
"2G5Q+R3X Mosque, Narowal - Muridke Rd, Kot Abdullah, Sheikhupura, Punjab, Pakistan","2",,,,,,,"2G5Q+R3X Mosque, Narowal - Muridke Rd","0","بسم اللہ سویٹس اینڈ ڈیری فارم","32.0096058","74.5377488","Bakery",,
"C975+4W4, Lahore – Kasur Rd, Youhanabad, Lahore, Punjab 54600, Pakistan","5",,,,,,"54600","C975+4W4, Lahore – Kasur Rd","584","Gourmet Foods","31.4127679","74.359832","Bakery","$$","4"
"19 km Lahore – Kasur Rd, Khayaban-e-Kareem, Lahore, Punjab 54000, Pakistan","6",,,,,,"54000","19 km Lahore – Kasur Rd","1596","Malmo Bakers & Sweets","31.4173352","74.3591372","Bakery","$$","4.2"
"C9C5+RCG, Lahore – Kasur Rd, Bilal Block Nishter Colony, Lahore, Punjab, Pakistan","9",,,,,,,"C9C5+RCG, Lahore – Kasur Rd","221","Star sweets & Bakers","31.4220679","74.3585767","Bakery","$$","4.1"
"213, Township Block 1 Sector D1 Lahore, Punjab 54770, Pakistan","12",,,,,,"54770","213","626","Gourmet Foods - Umar Chowk Township","31.4423952","74.305518","Bakery","$$","4"
"76 Pak-Arab Housing Scheme Main Rd, Block B Pak-Arab Housing Scheme, Lahore, Punjab 54000, Pakistan","14",,,,,,"54000","76 Pak-Arab Housing Scheme Main Rd","504","Gourmet Foods","31.4316063","74.3483682","Bakery",,"4.1"
"Plot 378, Sector D2 Sector D 2 Block 5 Green Town, Lahore, Punjab, Pakistan","15",,,,,,,"Plot 378","39","Chocolate Bakery","31.4325135","74.3112614","Bakery",,"4.4"
"Chak 5 1 RA, Kiraniwala, Kasur, Punjab, Pakistan","1",,,,,,,"Chak 5 1 RA","1","Nazeer sweets imran foods","30.9564271","73.8551385","Bakery",,"5"
"Wapda Avenue, WAPDA Town Block D 3 Wapda Town Phase 1 Lahore, Punjab, Pakistan","21","1246","419","52","96","19",,"Wapda Avenue","1832","Layers Bakeshop - Wapda Town","31.4407344","74.2743461","Dessert shop","$$","4.5"
"Plot #112, Block D2 Block D 2 Wapda Town Phase 1 Wapda Town, Lahore, Punjab 54770, Pakistan","24","20","6","5","1","0","54770","Plot #112","32","Cake Mystery Bakeshop - Wapda Town Branch","31.4400243","74.2741138","Bakery",,"4.1"
"C7RF+2MG, Roundabout, Block D2 Block D 2 Wapda Town Phase 1 Lahore, Punjab, Pakistan","34","898","533","88","186","56",,"C7RF+2MG, Roundabout","1761","Jalal Sons - Wapda Town","31.4400573","74.2741884","Bakery","$$","4.2"
"377 Sunday Bazar Rd, Sector D2 Sector D 2 Block 4 Green Town, Lahore, Punjab, Pakistan","35","50","10","1","17","3",,"377 Sunday Bazar Rd","81","Kashmir Bakerrs & sweets","31.4364321","74.3106929","Bakery",,"4.3"
"C936+35C, Dhoke Syedian Rd, Asif Town, Lahore, Rawalpindi, Punjab, Pakistan","37","1","0","1","0","0",,"C936+35C, Dhoke Syedian Rd","2","Simavi Bakers & Sweets","31.4026913","74.3603962","Bakery",,"3"
"Plot 14, Block, 1 College Road, Sector C2 Block 1 Twp Sector C 2 Lahore, Punjab 54770, Pakistan","38","567","195","40","57","9",,"Plot 14, Block, 1 College Road","868","Jawa Foods","31.4376439","74.2916126","Bakery",,"4.4"
"107-E, Block D PCSIR Staff Colony, Lahore, Punjab 54770, Pakistan","39","11","4","0","2","0","54770","107-E","17","The Bakery Tower","31.4287924","74.2816882","Bakery",,"4.5"
"C8M2+93W, Bagrian Rd, Township Block 6 Twp Sector C 2 Lahore, Punjab 54770, Pakistan","40",,,,,,"54770","C8M2+93W, Bagrian Rd","0","Hafiz Sweets","31.433491","74.3001921","Bakery",,
"Rahat Bakers, Nespak, adjacent to Evercare hospital, WAPDA Town Block D 1 Nespak Housing Scheme, Lahore, Punjab 54000, Pakistan","41","11","5","8","3","0","54000","Rahat Bakers, Nespak, adjacent to Evercare hospital","27","Rahat Premium","31.4372031","74.2797956","Bakery",,"3.4"
"H8C9+C97، Gawal Mandi Chowk, Chamberlain Rd, Anarkali Bazaar Lahore, Punjab 54000, Pakistan","17",,,,,,"54000","H8C9+C97، Gawal Mandi Chowk, Chamberlain Rd","66","Punjab Bakery","31.5710487","74.3184278","Bakery",,"4.2"
"H9M9+7JQ، Haq Nawaz Road 54000، Baghbanpura, Haq Nawaz Rd, Baghbanpura, Lahore, Punjab 54000, Pakistan","19",,,,,,"54000","H9M9+7JQ، Haq Nawaz Road 54000، Baghbanpura, Haq Nawaz Rd","420","Rafiq Sweets and Bakers (Headquarter)","31.5827452","74.3708975","Bakery",,"4.3"
"Sui Gas Chowk, Lajpat Rd, Chattha Park Shahdara Town, Shahdara, Lahore, Punjab 54000, Pakistan","22","123","26","16","24","15","54000","Sui Gas Chowk, Lajpat Rd","204","Habib Sweets And Bakers","31.6272831","74.2764545","Bakery","$$","4.1"
"Palza Number R222 -Block ""R, MotorWay, City, Lahore, Sheikhupura, Punjab, Pakistan","23","12","0","0","2","0",,"Palza Number R222 -Block ""R, MotorWay","14","YUMS Sweets and Bakers","31.6410516","74.2172007","Bakery",,"4.7"
"J7MP+FPC, Kashmir Park Rd, Shahdara Town, Lahore, Punjab, Pakistan","24","11","3","0","1","0",,"J7MP+FPC, Kashmir Park Rd","15","Nemat Sherien Sweets & Bakers","31.6336959","74.2867633","Bakery",,"4.7"
"J7JP+6WG, GT Rd, Shahdara, Shahdara Town, Lahore, Punjab 54950, Pakistan","25","10","5","4","10","0","54950","J7JP+6WG, GT Rd, Shahdara","29","Dory Bakers & Sweets","31.6305605","74.2873414","Bakery",,"3.6"
"feroz wala Branch, Peoples Colony, Lahore, Punjab, Pakistan M72M+85R Ferozewala, Main GT Rd, Peoples Colony, Lahore, Punjab, Pakistan","26","2","1","0","0","0",,"feroz wala Branch, Peoples Colony, Lahore, Punjab, Pakistan M72M+85R Ferozewala, Main GT Rd","3","Saddique Sweets And Bakers FEROZWALA BRANCH","31.6511244","74.2830341","Bakery",,"4.7"
"7553+4G Glamour Adda, Manga - Raiwind Road, Raiwind, Kasur, Punjab, Pakistan","1",,,,,,,"7553+4G Glamour Adda, Manga - Raiwind Road","36","JAWA SWEETS & BAKERS","31.2589136","74.1594348","Bakery",,"4.2"
"M74J+5Q7, Main Bazar Rachna Town, Rachna Town Ferozewala, Lahore, Punjab, Pakistan","27","2","0","0","0","0",,"M74J+5Q7, Main Bazar Rachna Town","2","Rana Ayaz whole sale bread 🍞 distributior","31.6554137","74.2819129","Bakery",,"5"
"J7FW+946, Basharat Rasul Shaheed Rd, Qazi Park Shahdara Town, Lahore, Punjab, Pakistan","28","43","9","5","10","5",,"J7FW+946, Basharat Rasul Shaheed Rd","72","Irfan Nirala Sweets Bakers","31.6234142","74.2952527","Bakery",,"4.1"
"762C+WQC, Raiwind Rd, Railway Colony Raiwind, Lahore, Punjab, Pakistan","9",,,,,,,"762C+WQC, Raiwind Rd","378","Gourmet Foods - Raiwind City","31.2523104","74.2218914","Bakery","$$","4.1"
"chock ghory shah, Shahdara Town, Shahdara, Lahore, Punjab, Pakistan","29","16","5","1","6","3",,"chock ghory shah","31","Sabir Sweets And Bakers","31.6279528","74.3043469","Bakery",,"4"
"1 Raiwind Rd, Raiwind, Kasur, Punjab 55150, Pakistan","11",,,,,,"55150","1 Raiwind Rd","700","Jawa Sweets & Bakers","31.2529317","74.2225013","Bakery","$$","4.2"
"Plot#C-01, D Block Block D Valencia, Lahore, Punjab 54000, Pakistan","19",,,,,,"54000","Plot#C-01","2086","Jalal Sons - Valencia","31.4087896","74.2592979","Bakery","$$","4.3"
"Gol Masjid Chowk, near Umer e farooq, Imamia Colony Shahdara, Lahore, Punjab 54950, Pakistan","30","7","1","0","5","1","54950","Gol Masjid Chowk, near Umer e farooq","14","Brotli Sweets and Bakers","31.6520224","74.2704302","Bakery",,"4"
"Kala Khatai Road, 9 Railway Rd, Jameel Park, Shahdara, Lahore, Punjab 54950, Pakistan","31","56","8","7","5","4","54950","Kala Khatai Road, 9 Railway Rd","80","Baba.Jagga Sweets","31.6446036","74.2884408","Bakery",,"4.3"
"Daulot Khan Rd, Shahdara Town, Shahdara, Lahore, Punjab 54950, Pakistan","32","75","27","9","15","7","54950","Daulot Khan Rd","133","Plaza Sweets & Bakers","31.6286128","74.2867304","Bakery",,"4.1"
"M76F+M6C, Rachna Town Ferozewala, Sheikhupura, Punjab, Pakistan","33","1","0","0","0","0",,"M76F+M6C","1","Bakery rachna town street number 25 shahdra Lahore","31.6616875","74.2730156","Bakery",,"5"
"Sharqpur bazar diamond sweet and baker,s Kot abdull mallik, Lahore, 39250, Pakistan","34","1","0","0","0","0","39250","Sharqpur bazar diamond sweet and baker,s Kot abdull mallik","1","Diamond sweet and bakers","31.619332","74.238475","Bakery",,"5"
"M75H+F9G, Rachna Town Ferozewala, Lahore, Punjab, Pakistan","35","8","0","1","2","1",,"M75H+F9G","12","Sharif Bakers & Sweets شریف بیکر اینڈ سویٹس","31.658684","74.2784912","Bakery",,"4.1"
"Lahore, Sargodha Road, Kot Abdul Malik, Sheikhupura, Punjab, Pakistan","36","197","70","24","67","15",,"Lahore, Sargodha Road","373","Gourmet sweet & bakers","31.6248472","74.2319179","Bakery","$$","4.1"
"J6FP+6R7 Chappar Stop, Lahore - Sheikhupura - Faisalabad Rd, Kot Abdul Malik, Sheikhupura, Punjab, Pakistan","37","7","1","0","0","0",,"J6FP+6R7 Chappar Stop, Lahore - Sheikhupura - Faisalabad Rd","8","Smile Sweets & Bakers","31.6230344","74.2370527","Bakery",,"4.9"
"M73J+HWQ, GT Rd, Peoples Colony Phase 3 Tayyaba Town, Ferozewala, Lahore, Punjab, Pakistan","38","39","18","3","11","3",,"M73J+HWQ, GT Rd","74","Butt Sweets & Bakers Premium and butt karahi","31.6538532","74.282507","Bakery",,"4.2"
,"20",,,,,,,,"1","heaven sweet","31.5266195","74.342955","Cake shop",,"5"
"N-5, Rachna Town Shahdara, Lahore, Punjab, Pakistan","39","80","28","11","26","4",,"N-5","149","Dory Restaurant","31.6556103","74.2820617","Bakery",,"4.1"
"GT Rd, Shahdara Town, Shahdara, Lahore, Punjab 54950, Pakistan","40","19","7","6","5","2","54950","GT Rd","39","Alam Bakers & Sweet's","31.6223125","74.2890625","Bakery",,"3.8"
"95GP+X5C، Sector C, Talwar Chowk, Bahria Town, Overseas Enclave Sector B Bahria Town, Lahore, Punjab 53720, Pakistan","5",,,,,,"53720","95GP+X5C، Sector C, Talwar Chowk, Bahria Town","620","Gourmet Foods","31.3774271","74.1853939","Bakery","$$","3.8"
"Sector C, Side B Tulip, adjacent to J, Commercial Bahria Town, Lahore, Pakistan","7",,,,,,,"Sector C, Side B Tulip, adjacent to J","21","Divine Bakers Bahria Town","31.3715675","74.1870874","Bakery",,"4.2"
"95FH+J2G, Bb Block Sector D Bahria Town, Lahore, Punjab, Pakistan","8",,,,,,,"95FH+J2G","2","Malik's Bakers&Easypesashop","31.3740628","74.1775801","Bakery",,"5"
"Shop F-321, Chauhatta، Mufti Bakar Chowk, Mohalla Ghonghat Chota Mufti Baqar Walled City of Lahore, Lahore, Punjab 54000, Pakistan","1",,,,,,"54000","Shop F-321, Chauhatta، Mufti Bakar Chowk","3462","Khalifa Bakers","31.5815113","74.3230187","Bakery",,"4.7"
"Nishat Chunian Textile, 4km Manga - Raiwind Road, Raiwind, Kasur, Punjab 52000, Pakistan","22",,,,,,"52000","Nishat Chunian Textile, 4km Manga - Raiwind Road","0","Hot Pan Cakes","31.2559078","74.1728971","Shoe store",,
"132-B, Jasmine Block, Commercial Area Sector C Bahria Town, Lahore, Punjab 54000, Pakistan","9",,,,,,"54000","132-B, Jasmine Block","212","Tanoor","31.3743825","74.1867742","Bakery",,"4.4"
"Shop No, 5 Circular Rd, Ram Gali Mochi Gate Walled City of Lahore, Lahore, Punjab 54000, Pakistan","2",,,,,,"54000","Shop No, 5 Circular Rd","2363","Khalifa Bakers Mochi Gate","31.5767792","74.3242806","Bakery",,"4.8"
"Sector D Street 4, Aa Block Sector D Bahria Town, Lahore, Punjab 54000, Pakistan","10",,,,,,"54000","Sector D Street 4","4","Ruoka Bakery","31.3731114","74.172438","Bakery",,"5"
"86PP+XJX, Raiwind Rd, Kot Araian, Lahore, Punjab, Pakistan","12",,,,,,,"86PP+XJX, Raiwind Rd","0","Fakhri Lahore bakery Araiyan raiwind road Lahore","31.3375197","74.2366566","Bakery",,
"Adda, Plot Roundabout Raiwind Rd, Block K Fazaia Housing Society, Lahore, Punjab, Pakistan","13",,,,,,,"Adda, Plot Roundabout Raiwind Rd","47","Cakes & Bakes","31.3634532","74.234351","Bakery","$$","4"
"Plot 103, Executive Lodges Sector B Bahria Town, Lahore, Punjab, Pakistan","14",,,,,,,"Plot 103","43","Kitchen Cuisine - Bahria Town","31.3850564","74.1688873","Bakery",,"4"
"H8XR+MCH, Triple Rd, Shad Bagh, Lahore, Punjab, Pakistan","6",,,,,,,"H8XR+MCH, Triple Rd","545","Bundu Khan Sweets & Bakers - Shad Bagh","31.5991907","74.3411162","Bakery",,"4.4"
"fast cata, New Rahat Bakery add polt, main Raiwind Rd, Pakistan","15",,,,,,,"fast cata, New Rahat Bakery add polt, main Raiwind Rd","249","New Rahat Bakers & Sweets","31.3582862","74.2354641","Bakery",,"4"
"Wyeth Housing Society Road, opposite A.M international, Lahore, Punjab 54000, Pakistan","16",,,,,,"54000","Wyeth Housing Society Road, opposite A.M international","50","Honey Munch","31.3845454","74.2338358","Bakery",,"4"
"Shop No. 1, Nisar Khan Plastic Center, opposite Police Station, Mochi Gate Walled City of Lahore, Lahore, Punjab 54000, Pakistan","10",,,,,,"54000","Shop No. 1, Nisar Khan Plastic Center, opposite Police Station","3005","Khalifa Bakers Nankhatai Home Delivery","31.57668","74.321604","Bakery","$$","4.6"
"HCP4+Q5F, Grand Trunk Rd, Zaitoon Colony, Lahore, Punjab 54000, Pakistan","11",,,,,,"54000","HCP4+Q5F, Grand Trunk Rd","541","Gourmet Foods گورمے فوڈز","31.5869268","74.4054329","Bakery",,"4.1"
"24 Shalimar Link Road Sahowari, stop Ramgarh, Lahore, Punjab 54000, Pakistan","14",,,,,,"54000","24 Shalimar Link Road Sahowari","62","Laraib Bakers & Sweets","31.5732197","74.3812127","Bakery",,"4.3"
"Shalimar Link Road, Muslim Colony, Lahore, Punjab 54000, Pakistan","17",,,,,,"54000","Shalimar Link Road","683","Cakes & Bakes","31.5787681","74.3814537","Bakery","$$","4.2"
"168-A Side Commercial Sector C, Gul Mohar Block, Bahria Town, Lahore, Pakistan","18",,,,,,,"168-A Side Commercial Sector C, Gul Mohar Block","224","OD - Bahria Town Lahore","31.3758047","74.1850742","Donut shop",,"4.2"
"959Q+G2V, Street 2, Tulip Extension Tulip Block Sector C Bahria Town, Lahore, Punjab, Pakistan","19",,,,,,,"959Q+G2V, Street 2","1","Bahria fries","31.368864","74.1875601","Bakery",,"5"
"95M5+X66, Maraka Village, Lahore, Punjab, Pakistan","20",,,,,,,"95M5+X66","6","Family Mart and Baker's","31.384925","74.1580159","Bakery",,"4.3"
"R724+684, Karkhana Bazar, Mohalla Ahmad Pura Mohalla Ahmedpura, Muridke, Sheikhupura, Punjab, Pakistan","13",,,,,,,"R724+684, Karkhana Bazar","3","Zain Bakery","31.8005132","74.255837","Bakery",,"3"
"R7Q6+HQ8 Distt Sheikhupura, villege Nangal Sadhan, Muridke, Sheikhupura, Punjab 39350, Pakistan","14",,,,,,"39350","R7Q6+HQ8 Distt Sheikhupura, villege Nangal Sadhan","0","cake home","31.838921","74.2619489","Bakery",,
"AL-HAMD milk center, Noor colony, Wandala Rd, opposite to unique school system, near darbar behkay shah, Shahdara Town, Shahdara, Lahore, Punjab, Pakistan","41","1","0","0","0","0",,"AL-HAMD milk center, Noor colony, Wandala Rd, opposite to unique school system, near darbar behkay shah","1","Usama Sweets and Bakers","31.6349031","74.2747832","Bakery",,"5"
"Main Bazar, Shahdara Town, Shahdara, Lahore, Punjab 54000, Pakistan","42","1","0","0","0","0","54000","Main Bazar","1","Sabir Sweets & Bakers","31.6211012","74.2824092","Bakery",,"5"
"Mehmood Colony Ferozewala, Lahore, Punjab, Pakistan","43","2","1","0","0","0",,,"3","Al Mukhtar Sweets and cosmetics","31.6426162","74.2787454","Bakery",,"4.7"
"J8G3+8C2، Shahdra Town Road, Shahdara Town, Lahore, Punjab, Pakistan","44","10","2","3","3","1",,"J8G3+8C2، Shahdra Town Road","19","Butt Sweets and Bakers shahdara town branch","31.6257721","74.3035145","Bakery",,"3.8"
"mall Kot, Service Rd, Shahab Din Road, Shahdara, Pakistan","45","1","2","0","0","0",,"mall Kot, Service Rd, Shahab Din Road","3","Butt Sweets & Bakers","31.6242001","74.2886687","Bakery",,"4.3"
"J7FX+JCM, Basharat Rasul Shaheed Rd, Qazi Park Daroga wala, Lahore, Punjab, Pakistan","46","123","67","38","50","14",,"J7FX+JCM, Basharat Rasul Shaheed Rd","292","Gourmet Foods","31.6240809","74.2985377","Bakery","$$","3.8"
"Bank, Lahore - Sheikhupura - Faisalabad Rd, near MCB, Kot Abdul Malik, Lahore, Sheikhupura, Punjab 52250, Pakistan","47","1","0","0","0","0","52250","Bank, Lahore - Sheikhupura - Faisalabad Rd, near MCB","1","Bilal Bakers & Sweets","31.6228011","74.2380488","Bakery",,"5"
"J7GW+C3R, Qazi Park Shahdara Town, Lahore, Punjab, Pakistan","48","2","0","0","0","0",,"J7GW+C3R","2","اصغرعلي نان والا","31.6261084","74.2951483","Bakery",,"5"
"J7HH+2MC, Lajpat Rd, Chattha Park Shahdara Town, Shahdara, Lahore, Punjab 54000, Pakistan","49","5","1","0","2","1","54000","J7HH+2MC, Lajpat Rd","9","VIP Bakery and Store","31.6275505","74.2791384","Bakery",,"4.1"
"J7RH+JG2, Mehmood Colony Barkat Town, Ferozewala, Lahore, Punjab, Pakistan","50","1","0","0","0","0",,"J7RH+JG2","1","Faiq sweets and baker's","31.641522","74.2787753","Bakery",,"5"
"J7F4+6GX, Pind Nizampura Dhaka, Lahore, Sheikhupura, Punjab, Pakistan","51","1","0","0","0","0",,"J7F4+6GX","1","Baba naan shop","31.6231069","74.2563612","Bakery",,"5"
"1 Larechs Colony Road, Larex Colony Shahdara Town, Shahdara, Lahore, Punjab, Pakistan","52","4","0","0","0","0",,"1 Larechs Colony Road","4","BHOLA DAIRY SHOP","31.6271009","74.289718","Bakery",,"5"
"Lake City Mall, Lake City, Lahore, Pakistan","36","277","136","30","59","23",,"Lake City Mall","525","The Sweet Factory - Lake City","31.3541532","74.2520654","Ice cream shop",,"4.2"
"city p block, plaza, 444 Lahore-Islamabad Mtwy, Sheikhupura, Punjab, Pakistan","53","4","0","2","0","0",,"city p block, plaza, 444 Lahore-Islamabad Mtwy","6","Chunk and cheese","31.6381218","74.2106935","Bakery",,"3.7"
"J7F3+XH4, Pind Nizampura Dhaka, Lahore, Sheikhupura, Punjab, Pakistan","54","10","1","4","0","0",,"J7F3+XH4","15","AL_jannat bakers & sweets shop","31.624881","74.2539462","Bakery",,"3.9"
"J7HQ+P2G، MAIN G T, Wandala Rd, Shahdara Town, Shahdara, Lahore, Punjab, Pakistan","55","2","1","1","1","0",,"J7HQ+P2G، MAIN G T, Wandala Rd","5","Baba Khan Sweets And Bakers","31.6293161","74.2875689","Bakery",,"3.6"
"Add plot, Raiwind Rd, Lahore, Pakistan","38","11","4","2","3","0",,"Add plot, Raiwind Rd","20","Kitchen Cuisine","31.3635135","74.2343766","Bakery","$$$","4.1"
"J6GQ+M7, Kot Abdul Malik, Sheikhupura, Punjab, Pakistan","56","1","0","0","0","0",,"J6GQ+M7","1","Imtiaz","31.6267195","74.2382598","Bakery",,"5"
"Block M 7 Lake City, Lahore, Punjab, Pakistan","39","641","319","58","97","35",,,"1150","Jalal Sons Lakecity","31.3531875","74.2485625","Supermarket",,"4.3"
"J7CJ+CWF, Shahdara Town, Shahdara, Lahore, Punjab, Pakistan","57","1","0","0","0","0",,"J7CJ+CWF","1","Musa","31.621061","74.2823103","Bakery",,"5"
"969R+CPC, Main Blvd, Block A Fazaia Housing Society, Lahore, Punjab, Pakistan","40","0","0","0","1","0",,"969R+CPC, Main Blvd","1","Gourmet Foods - Fazaia Housing Society","31.3685569","74.241779","Bakery",,"3"
"J7HH+WPP, Sui Gas Rd, Aziz Colony Shahdara Town, Lahore, Punjab, Pakistan","58","10","4","0","4","3",,"J7HH+WPP, Sui Gas Rd","21","New Manj Sweets & Bakers نیو منج سوئیٹس اینڈ بیکرز","31.6298333","74.2793145","Bakery",,"4"
"J6FQ+4F9, Kot Abdul Malik, Sheikhupura, Punjab, Pakistan","59","2","0","1","0","0",,"J6FQ+4F9","3","Eminabadi Barfi & Sweet","31.6227772","74.2387424","Bakery",,"3.7"
"chowck jhalaran, Shahdara Town, Lahore, Punjab 54950, Pakistan","60",,,,,,"54950","chowck jhalaran","0","BABAR BAKERY","31.6272592","74.3012008","Bakery",,
"R753+RC2, Karkhana Bazar, Rehmanpura, Muridke, Sheikhupura, Punjab 54000, Pakistan","35",,,,,,"54000","R753+RC2, Karkhana Bazar","0","alam bks","31.8095216","74.2535107","Bakery",,
"RRCC+PHQ, Main St, Issar Kay, Sheikhupura, Punjab, Pakistan","21","1","0","0","0","0",,"RRCC+PHQ, Main St","1","Bahoo Sweets","31.8218416","73.8214721","Cake shop",,"5"
"J6JQ+2J3, Kot Abdul Malik, Lahore, Sheikhupura, Punjab, Pakistan","61","1","0","1","0","0",,"J6JQ+2J3","2","Meharazeem","31.6300202","74.2390477","Bakery",,"3"
"J7WR+3WC, Barkat Town Ferozewala, Lahore, Punjab, Pakistan","62","0","1","0","1","0",,"J7WR+3WC","2","Dory Bakers","31.6451758","74.2922772","Bakery",,"3.5"
"J7GJ+WQH, Shahdara Town, Shahdara, Lahore, Punjab, Pakistan","63","1","0","0","0","0",,"J7GJ+WQH","1","house of Mansha","31.6273171","74.2819839","Bakery",,"5"
"J7XH+W3F Husnain Chock, Imamia Colony Rd, Main Bazar Imamia Colony Shahdara, Lahore, Punjab 54950, Pakistan","64",,,,,,"54950","J7XH+W3F Husnain Chock, Imamia Colony Rd","0","Dory Bakers and Sweets","31.6498032","74.2776831","Bakery",,
"Main Bazar Rachna Town, Peoples Colony Ferozewala, Lahore, Punjab, Pakistan","65","2","0","1","0","0",,"Main Bazar Rachna Town","3","Delight sweets & bakers","31.6536831","74.2746316","Bakery",,"3.7"
"Block M 1 Lake City, Lahore, Punjab, Pakistan","42","75","47","14","13","6",,,"155","OD - Lake City","31.3540718","74.2516126","Donut shop",,"4.1"
"J7PM+F2C, Shahdara Town, Shahdara, Lahore, Punjab, Pakistan","66","2","0","0","0","0",,"J7PM+F2C","2","SUBHAN NAN SHOP","31.6361892","74.282531","Bakery",,"5"
"M7F9+GXW, Rana Town, Ferozewala, Sheikhupura, Punjab, Pakistan","67","1","0","0","0","0",,"M7F9+GXW","1","Shahi super store and bakers","31.6738638","74.2699483","Bakery",,"5"
"Dhupsari, Lahore, Punjab, Pakistan","44","4","1","0","1","0",,,"6","Rattala Bakers & Sweets","31.3382101","74.1489978","Bakery",,"4.5"
"J69Q+P99, Kot Abdul Malik, Lahore, Sheikhupura, Punjab, Pakistan","68","0","0","0","1","0",,"J69Q+P99","1","Mohsin sweet &baker","31.6192982","74.2384744","Bakery",,"3"
"299 New Lahore City Rd, Lahore, Punjab, Pakistan","45","1","0","0","0","0",,"299 New Lahore City Rd","1","Home made food","31.3424367","74.1517976","Bakery",,"5"
"Kalakhati road gio, Karoul Bharth, Shahdara, Sheikhupura, Punjab 54950, Pakistan","69",,,,,,"54950","Kalakhati road gio","0","A ONE SWEETS & BAKERS","31.6682647","74.316771","Bakery",,
"Raiwind Rd, opposite Lake City Main Boulevard, Adda plot Lahore, Punjab 53720, Pakistan","46","522","239","49","93","27","53720","Raiwind Rd, opposite Lake City Main Boulevard","930","Jawa Foods","31.3539707","74.2368424","Fast food restaurant",,"4.2"
"Shop No 9-B Canal Height main canal road AA Block, D Bahria Town, Lahore, 54000, Pakistan","47","21","0","0","0","0","54000","Shop No 9-B Canal Height main canal road AA Block","21","HASHMI GRAINS & BAKERS","31.3790284","74.1681751","Bakery",,"5"
"J6M6+C3M, Gulfishan Town, Lahore, Sheikhupura, Punjab, Pakistan","70","2","0","0","0","0",,"J6M6+C3M","2","Data Tradar","31.6338655","74.2108727","Bakery",,"5"
"96MH+7V3, Kot Bagh Lahore, Punjab, Pakistan","49","2","0","0","0","0",,"96MH+7V3","2","Amir dogar market","31.3831432","74.2296624","Bakery",,"5"
"86PP+RFJ, Raiwind Rd, Kot Araian, Lahore, Punjab, Pakistan","50","5","0","2","1","1",,"86PP+RFJ, Raiwind Rd","9","New Nasir Sweets","31.3370976","74.2361505","Bakery",,"3.6"
"Latif choke, Wandala Rd, Shahdara Town, Lahore, Punjab, Pakistan","71","2","2","0","0","0",,"Latif choke, Wandala Rd","4","Ali baba bakers","31.632393","74.2821767","Bakery",,"4.5"
"9568+954, Bahria Town, Lahore, Punjab, Pakistan","51","1","0","0","0","0",,"9568+954","1","Abrar","31.3608803","74.1655119","Bakery",,"5"
"J794+WJP, Main Bazar Rd, Pind Nizampura Dhaka, Lahore, Sheikhupura, Punjab, Pakistan","72",,,,,,,"J794+WJP, Main Bazar Rd","0","Saith sweets","31.6198458","74.2565797","Bakery",,
"117-A, gul mohar Bahria Town, Lahore, 54000, Pakistan","52","9","1","1","0","0","54000","117-A","11","Naan Mahal","31.3735527","74.1847311","Bakery",,"4.5"
"E, ghari chowk, sector Lavandus Block Bahria Town, Lahore, Punjab 53720, Pakistan","53",,,,,,"53720","E, ghari chowk","0","crazy bakers","31.3629818","74.1864295","Bakery",,
"J7JM+95J, Sui Gas Rd, Shahdara Town, Lahore, Punjab, Pakistan","73","3","0","0","0","0",,"J7JM+95J, Sui Gas Rd","3","BNS Food Point","31.6309632","74.2829022","Bakery",,"5"
"96F7+JW3, Eden Park Lahore, Punjab, Pakistan","54","0","1","0","0","0",,"96F7+JW3","1","S&S Cakery","31.3740213","74.2147866","Bakery",,"4"
"J6FJ+WQJ, Kot Abdul Malik, Sheikhupura, Punjab, Pakistan","74","1","0","0","2","0",,"J6FJ+WQJ","3","Hafiz sweet Lal khooh kot Abdulmalik","31.624843","74.2319451","Bakery",,"3.7"
"95GC+JM2, AA-Block Aa Block Sector D Bahria Town, Lahore, Punjab, Pakistan","55",,,,,,,"95GC+JM2","0","Umer Bakery","31.3765007","74.1716511","Bakery",,
"Main service Rd Shahdara, Shahdara Town, Lahore, Punjab 54950, Pakistan","75",,,,,,"54950","Main service Rd Shahdara","0","MashaAllah Jaleibi House","31.6212007","74.2893408","Bakery",,
"95M4+366, Maraka Village, Lahore, Punjab, Pakistan","56",,,,,,,"95M4+366","0","Hamza bakery","31.3826727","74.1555208","Bakery",,
"Plot 77, Block H Fazaia Housing Society, Lahore, Punjab, Pakistan","57","1","0","0","1","0",,"Plot 77","2","Al Khan Sweets","31.3685458","74.2416027","Candy store",,"4"
"J7GC+XWP, Lajpat Rd, Shahdara Town, Lahore, Punjab, Pakistan","76",,,,,,,"J7GC+XWP, Lajpat Rd","0","Al-Azhar Sweet & Baker's","31.627466","74.2723176","Bakery",,
"M899+F34, Karoul Sheikhupura, Punjab, Pakistan","77",,,,,,,"M899+F34","0","Baba baga sweet&bakers","31.6686312","74.3176925","Bakery",,
"Shop #2, 81-B, Ground Floor, Rafi Block Commercial E, Lahore, Pakistan","58","75","9","6","3","1",,"Shop #2, 81-B, Ground Floor, Rafi Block Commercial E","94","Roti Shoti","31.365063","74.1873952","Bakery",,"4.6"
"J69Q+P99, Kot Abdul Malik, Lahore, Sheikhupura, Punjab, Pakistan","78","0","1","0","0","0",,"J69Q+P99","1","کوٹ عبدالمالک","31.6192983","74.2384744","Bakery",,"4"
"Raiwind Rd, Kot Araian, Lahore, Punjab, Pakistan","59",,,,,,,"Raiwind Rd","0","Taj Sweets","31.3366143","74.2360081","Bakery",,
