"address","rank","reviewsDistribution/fiveStar","reviewsDistribution/fourStar","reviewsDistribution/oneStar","reviewsDistribution/threeStar","reviewsDistribution/twoStar","postalCode","street","reviewsCount","title","location/lat","location/lng","categoryName","price","totalScore"
"10 A, Lahore, 54000, Pakistan","1",,,,,,"54000","10 A","333","Baked","31.4684272","74.4397007","Bakery",,"4.4"
"Main Boulevard, Shabbir Sharif Rd, DHA Phase 6, Lahore, 54000, Pakistan","2",,,,,,"54000","Main Boulevard, Shabbir Sharif Rd","453","Cakes & Bakes","31.476147","74.4467766","Bakery",,"4.2"
"Street 14, Sector F DHA Phase 6, Lahore, Punjab, Pakistan","3",,,,,,,"Street 14","43","Her Pretty Bakes","31.4626244","74.4645971","Cake shop",,"5"
"139, Sector J DHA Phase 6, Lahore, Punjab 54792, Pakistan","4",,,,,,"54792","139","832","Layers Bakeshop - Phase 6 DHA","31.4819792","74.4545175","Bakery",,"4.5"
"25 Street 11, Sector H DHA Phase 6, Lahore, Punjab, Pakistan","5",,,,,,,"25 Street 11","1314","Jalal Sons - DHA Phase 6","31.4780552","74.4492379","Bakery","$$","4.3"
"Sector mb, 6 plaza number 114, Phase DHA Phase 6, Lahore, 54792, Pakistan","6",,,,,,"54792","Sector mb, 6 plaza number 114","168","Pie in the sky DHA ph-6 Lahore","31.4799535","74.4515394","Bakery","$$","4.5"
"C, 12 CCA, DHA Phase 5 Defence Housing Authority, Lahore, 54792, Pakistan","7",,,,,,"54792","C, 12 CCA","123","The Cakery","31.4627867","74.4138994","Bakery",,"4.5"
"FCV8+8V7, Ghazi Rd, Gulshan e Ali Colony, Lahore, Punjab, Pakistan","8",,,,,,,"FCV8+8V7, Ghazi Rd","807","Gourmet Foods","31.4932889","74.4171723","Bakery",,"4"
"26 N, 1 Dha, phase Dha Phase 1, Lahore, 54792, Pakistan","9",,,,,,"54792","26 N, 1 Dha","229","Yum Prum","31.4880184","74.3962809","Bakery",,"4.8"
"36 Main Blvd, Sector B DHA Phase 6, Lahore, Punjab, Pakistan","10",,,,,,,"36 Main Blvd","244","Chashni","31.4740365","74.4438386","Dessert shop","$$$","4.2"
"2nd floor, Plaza 64, DHA Phase 8 - Ex Air Avenue Block Q Air Avenue, Lahore, Punjab 54000, Pakistan","11",,,,,,"54000","2nd floor, Plaza 64","154","Opulence Bakery","31.5025376","74.4446162","Bakery",,"4.5"
"House #E-492/A, Bedian Rd, Alfalah Town Phase 1 Cantt, Lahore, Punjab 54810, Pakistan","12",,,,,,"54810","House #E-492/A, Bedian Rd","24","Delicieux_sana","31.4822329","74.4182392","Cake shop",,"5"
"FCX9+HMC, Main Airport Rd, next to Eden Ext, Eden Avenue, Lahore, Punjab, Pakistan","13",,,,,,,"FCX9+HMC, Main Airport Rd, next to Eden Ext","581","Kitchen Cuisine","31.4985938","74.4210701","Bakery",,"4.4"
"Building 103, Raya Fairways، M، Phase 6 DHA, Lahore, 54810, Pakistan","14",,,,,,"54810","Building 103, Raya Fairways، M","268","Pink Pistachio Patisserie & Cafe","31.474134","74.4702505","Art cafe",,"4"
"House 643, Street 26, A Block Sector A Phase 5 D.H.A, Lahore, Punjab 54000, Pakistan","15",,,,,,"54000","House 643, Street 26","42","Cakes Town Cafe","31.4690252","74.4246241","Bakery",,"4.5"
"CCXM+9FM, Askari 11 Sector B, Lahore, Punjab, Pakistan","16",,,,,,,"CCXM+9FM","493","Jalal Sons","31.4484692","74.4336742","Bakery","$$","4"
"Plot no 31 CCA, Lahore, Pakistan","17",,,,,,,"Plot no 31 CCA","238","Pie in the Sky DHA PH-5 Lahore","31.4615188","74.4140118","Bakery","$$","4.3"
"Plot 552, Sector K DHA Phase 6, Lahore, Punjab, Pakistan","18",,,,,,,"Plot 552","4","Patisserie","31.471384","74.4611421","Bakery",,"3.8"
"96 Q Street 10, DHA Phase 8 - Ex Air Avenue Block Q DHA Phase 8, Lahore, Punjab, Pakistan","19",,,,,,,"96 Q Street 10","70","Cake Walk DHA Phase 8","31.5032807","74.4460708","Bakery",,"4.3"
"GH4P+43C, Chak 5 GB, Nankana Sahib, Punjab, Pakistan","2",,,,,,,"GH4P+43C","2","Yousaf Sweets","31.5053007","73.5851432","Bakery",,"5"
"CPX4+V65, Bashir Bhatti Rd, Mohalla Masjid Noor, Nankana Sahib, Punjab, Pakistan","5",,,,,,,"CPX4+V65, Bashir Bhatti Rd","8","Raheem Sweets Bashir bhatti road","31.4496362","73.7056178","Bakery",,"4"
"Divine Mega 2, Ghazi Rd, Gulshan e Ali Colony, Lahore, Punjab, Pakistan","20",,,,,,,"Divine Mega 2, Ghazi Rd","46","Butt Sweets","31.4937989","74.417609","Bakery","$$","3.8"
"HFGJ+8J3, Ward Number 10 Shahkot, Nankana Sahib, Punjab, Pakistan","7",,,,,,,"HFGJ+8J3","1","Mood bakers and restaurant","31.5757532","73.4815343","Bakery",,"5"
"P.A.F Market, Sarfaraz Rafiqui road،, Sarfaraz Rafiqui Rd, Cantt, Lahore, Punjab, Pakistan","8",,,,,,,"P.A.F Market, Sarfaraz Rafiqui road،, Sarfaraz Rafiqui Rd","923","Baked","31.5197792","74.3818382","Bakery",,"4.3"
"Shora Khoti Road, Nankana Sahib, Pakistan","9",,,,,,,"Shora Khoti Road","89","Gourmet Bakers and Sweets","31.4491313","73.7124951","Bakery","$$","4.2"
"LG- 06 Al-Hafeez Tower MM Alam Road،, Ghalib Rd, Block C 1 Gulberg III, Lahore, Punjab 54660, Pakistan","14",,,,,,"54660","LG- 06 Al-Hafeez Tower MM Alam Road،, Ghalib Rd","345","Cake Valley - Custom Cake Shop Lahore","31.5132583","74.3506556","Cake shop",,"4.2"
"FP35+GJ4, Railway Road, Nankana Sahib, Punjab 39100, Pakistan","15",,,,,,"39100","FP35+GJ4, Railway Road","60","Afzal Bakers & Sweets","31.4537733","73.7090763","Bakery",,"4.2"
"HMQR+43C, Nankana Rd, Madina Colony, Manan Wala, Sheikhupura, Punjab, Pakistan","18",,,,,,,"HMQR+43C, Nankana Rd","12","Gourmet Baker's & Sweet's Manawala","31.587801","73.6901552","Bakery",,"3.7"
"Railway Rd, Nankana Sahib, Punjab, Pakistan","19",,,,,,,"Railway Rd","220","Raheem Sweets","31.451338","73.7060237","Bakery",,"4.3"
"PHGG+FR5, Khanqah Dogran Rd, Safdarabad, Nankana Sahib, Punjab, Pakistan","20",,,,,,,"PHGG+FR5, Khanqah Dogran Rd","1","Gourmet Bakers & Sweets","31.7261259","73.5771105","Bakery","$$","5"
"Pentasquare mall, Sector C Phase 5 D.H.A, Lahore, Punjab, Pakistan","30","90","22","17","9","5",,"Pentasquare mall","143","Loafology Bakery & Cafe - Pentasquare DHA 5","31.4620425","74.4152743","Bakery",,"4.1"
"38 Raya Fairways, Defence Raya Golf Resort Sector M DHA Phase 6, Lahore, Punjab 54792, Pakistan","31","966","92","32","23","15","54792","38 Raya Fairways","1128","Haute Dolci Lahore","31.4734948","74.4693945","Dessert restaurant",,"4.7"
"FC77+4JX, Street 14, Sector C Phase 5 D.H.A, Lahore, Punjab, Pakistan","38","2","0","1","2","0",,"FC77+4JX, Street 14","5","Forever Bakery","31.462856","74.4140938","Bakery",,"3.4"
"9 CCA, Khayaban-e-Jinnah، near Wateen Chowk, Sector C Phase 5 D.H.A, Lahore, Punjab 54000, Pakistan","40","2745","1258","178","476","124","54000","9 CCA, Khayaban-e-Jinnah، near Wateen Chowk","4781","Jalal Sons","31.4632733","74.4136758","Supermarket",,"4.3"
"FFC6+5C8, Sector K DHA Phase 6, Lahore, Punjab, Pakistan","42","0","1","1","2","0",,"FFC6+5C8","4","Pastry Shop, DHA Club Phase 6","31.4704106","74.4610633","Cafe",,"2.8"
"FC68+P4M, Sector C Phase 5 D.H.A, Lahore, Punjab, Pakistan","43","3422","1515","242","1107","314",,"FC68+P4M","6600","Civic Commercial Area","31.4618257","74.4152823","Market",,"4.1"
"43-CCA, Sector C Phase 5 D.H.A, Lahore, 54000, Pakistan","44","36","5","10","0","2","54000","43-CCA","53","Glazed","31.4626802","74.4137595","Dessert shop",,"4"
"House 3031, Multan Rd, Park View City Lahore thokar, Lahore, Punjab 54700, Pakistan","1",,,,,,"54700","House 3031, Multan Rd","12","Out of the Box","31.4572398","74.1884985","Bakery",,"5"
"Armish Rd, Block A Izmir, Lahore, Punjab, Pakistan","2",,,,,,,"Armish Rd","832","Cakes & Bakes","31.4205519","74.1839676","Bakery","$$","4.2"
"C54Q+XRH, Main Blvd, Block D Commercial Area Jubilee Town Housing Scheme, Lahore, Punjab, Pakistan","3",,,,,,,"C54Q+XRH, Main Blvd","45","Sweet Corner & Bakers","31.4074365","74.1895993","Bakery",,"4.7"
"C5HG+3Q4, Multan Rd, Chung, Lahore, Punjab, Pakistan","4",,,,,,,"C5HG+3Q4, Multan Rd","371","Malmo Bakery And Sweets","31.4276286","74.176952","Bakery",,"4.1"
"9 b1, Johar Town, Lahore, Pakistan","5",,,,,,,"9 b1","489","Crumbs The Bakers","31.4620231","74.2998111","Bakery",,"4.9"
"21, Tulip commercial, Park View City Lahore tulip, Lahore, Punjab 54000, Pakistan","6",,,,,,"54000","21, Tulip commercial","14","Urban Bakery","31.4567669","74.193324","Bakery",,"4.4"
"Rail Town Canal City, Lahore, Punjab 42000, Pakistan","7",,,,,,"42000",,"581","Cakes & Bakes","31.4371897","74.2087022","Bakery","$$","4"
"Plaza 09، near Surahi Chowk, AA-Block Aa Block Sector D Bahria Town, Lahore, Punjab 54000, Pakistan","8",,,,,,"54000","Plaza 09، near Surahi Chowk","484","bakisto - the cake company","31.3738781","74.1730034","Cake shop","$","4.9"
"Shop No.40, R, 1 Block, near Shadiwal Chowk, Johar Town, Lahore, 54782, Pakistan","9",,,,,,"54782","Shop No.40, R, 1 Block, near Shadiwal Chowk","423","Layers Bakeshop - Johar Town R1 Block","31.4567689","74.2770946","Bakery","$$","4.6"
"Block D PIA Society, Lahore, Punjab 54770, Pakistan","10",,,,,,"54770",,"328","Billy Marda","31.4432499","74.280493","Bakery",,"5"
"Plot#62-A, Sector C Commercial Area Sector C Bahria Town, Lahore, Punjab, Pakistan","11",,,,,,,"Plot#62-A","1034","Layers Bakeshop - Bahria Town Sector C","31.3703514","74.1857763","Bakery","$$","4.5"
"305/25 H3, H3, Johar Block H 3 Phase 2 town, Lahore, Punjab 54000, Pakistan","12",,,,,,"54000","305/25 H3, H3","51","Divine Bakers","31.4712489","74.2596851","Bakery",,"4.7"
"9 Beadon Rd, Victoria Park Lahore, Punjab 54000, Pakistan","13",,,,,,"54000","9 Beadon Rd","1330","Bay bakery","31.5641214","74.3219237","Bakery",,"4.5"
"Block R Block G Phase 2 Johar Town, Lahore, Punjab 54782, Pakistan","14",,,,,,"54782",,"3605","Layers Bakeshop - G1, Johar Town","31.4758377","74.2810182","Bakery","$$$","4.5"
"F66V+HR5 Ali Raza Abad, Raiwind Rd, Ali Town Lahore, Punjab 54000, Pakistan","15",,,,,,"54000","F66V+HR5 Ali Raza Abad, Raiwind Rd","2852","Gourmet Foods - Ali Town, Raiwind Road","31.4613913","74.2446228","Bakery",,"4.1"
"434, G1 Market, Johar Town, Lahore, 54782, Pakistan","16",,,,,,"54782","434, G1 Market","308","Baba Bakers & Sweets","31.4722649","74.2780609","Bakery",,"4.3"
"905 Canal Bank Road, Canal Bridge, opp. Bahria Town, Lahore, Pakistan","17",,,,,,,"905 Canal Bank Road, Canal Bridge, opp. Bahria Town","448","Cakes & Bakes","31.3904695","74.1690618","Bakery",,"4.2"
"Bahria, House #47 Gardenia block, C, Town, Lahore, 54000, Pakistan","18",,,,,,"54000","Bahria, House #47 Gardenia block, C","23","Cravings","31.3756538","74.1794675","Cake shop",,"5"
"Nishtar Block Nishter Block Allama Iqbal Town, Lahore, Punjab, Pakistan","19",,,,,,,,"33","Sweetify by Fatima","31.5068288","74.2751042","Bakery",,"5"
"Service Rd, Sector C Commercial Area Sector C Bahria Town, Lahore, Punjab 53720, Pakistan","20",,,,,,"53720","Service Rd","1458","Cakes & Bakes","31.3713429","74.1866571","Bakery","$$","4.2"
"GRQJ+R53, Unnamed Road, Warburton, Nankana Sahib, Punjab, Pakistan","1",,,,,,,"GRQJ+R53, Unnamed Road","5","Gourmet bakers and sweets","31.5395737","73.8303926","Bakery",,"4"
"Ada Feroz wattwan، Faisalabad Road، FEROZ WATTWAN DISTRICT SHEIKHUPURA, Pakistan","8",,,,,,,"Ada Feroz wattwan، Faisalabad Road","59","Bilal Sweets And Bakers","31.5885089","73.8125063","Bakery",,"4.3"
"PRXF+WG3, Lahore - Sargodha Rd, Farooqabad, Sheikhupura, Punjab, Pakistan","9",,,,,,,"PRXF+WG3, Lahore - Sargodha Rd","7","Wali Sweets & Bakers","31.7497601","73.8238008","Bakery",,"4.1"
"F36X+F5F, Sharaqpur, Sheikhupura, Punjab, Pakistan","21","4","3","2","1","0",,"F36X+F5F","10","Dory Bakers Sharaqpur","31.4611802","74.0979277","Bakery",,"3.7"
"F34W+7MF, Sharaqpur, Sheikhupura, Punjab, Pakistan","22","2","0","0","0","0",,"F34W+7MF","2","Bitter bites(BB)","31.4556787","74.0966616","Bakery",,"5"
"F472+7X3, Sharaqpur Sharif Main Rd, Sharaqpur, Sheikhupura, Punjab, Pakistan","23","5","1","2","0","1",,"F472+7X3, Sharaqpur Sharif Main Rd","9","Gourmet Foods - Sharaqpur","31.4631455","74.1024069","Bakery","$$","3.7"
"2V85+568, Pattoki - Chunian Rd, Old Mandi Pattoki, Kasur, Punjab, Pakistan","1",,,,,,,"2V85+568, Pattoki - Chunian Rd","208","Best Sweet & Bakers","31.0170821","73.8533137","Bakery",,"4.3"
"XX8G+4H7 Lahori sweet and baker's, infornt of national bank, Chunian, Kasur, Punjab, Pakistan","2",,,,,,,"XX8G+4H7 Lahori sweet and baker's, infornt of national bank","1","Lahori sweet and baker's","30.965288","73.9764096","Bakery",,"5"
"XX7G+WWV, Chunian, Kasur, Punjab, Pakistan","6",,,,,,,"XX7G+WWV","10","Jalandhar Sweets Baker's & General Store","30.9648688","73.9772814","Bakery",,"4.3"
"THQ) Hospital, 147 ft Tehsil Head Quarter, Chunian, Kasur, Punjab, Pakistan","11",,,,,,,"THQ) Hospital, 147 ft Tehsil Head Quarter","4","Mehran Sweet & Bakers","30.9664938","73.9744669","Bakery",,"4.5"
"P7P8+G26, Baoli, Jamada, 39000, Pakistan","1",,,,,,"39000","P7P8+G26, Baoli, Jamada","378","PANACHE (The Bake Shop)","31.7363087","74.2650807","Bakery",,"4.3"
"Q7X3+RQV, Main GT Rd, Canal Park Piran Basti, Muridke, Sheikhupura, Punjab, Pakistan","2",,,,,,,"Q7X3+RQV, Main GT Rd","17","Tariq Sweets And Bakes","31.7996562","74.2544323","Bakery",,"4.5"
"R723+6PW, Canal Park Piran Basti, Muridke, Sheikhupura, Punjab, Pakistan","3",,,,,,,"R723+6PW","1087","Gourmet Foods","31.8006002","74.2543434","Bakery",,"3.9"
"R733+3G2, Main Bazaar, Mohalla Faiz Madina Mohalla Sheikhan, Muridke, Sheikhupura, Punjab, Pakistan","4",,,,,,,"R733+3G2, Main Bazaar","180","Siddique Sweets and Bakers","31.8026393","74.2537741","Bakery",,"4"
"Muridke Town Main Bazar, Faisal Park Muridke, Sheikhupura, Punjab 39000, Pakistan","5",,,,,,"39000","Muridke Town Main Bazar","7","Al-Bashir Sweets And Bakers","31.801453","74.2641107","Bakery",,"5"
"R724+PW3, Main Bazaar, Mohalla Ahmad Pura Mohalla Sheikhan, Muridke, Sheikhupura, Punjab, Pakistan","6",,,,,,,"R724+PW3, Main Bazaar","1","پاکستان sweets and bakers","31.801756","74.257312","Bakery",,"4"
"Q7X3+JJ8, Canal Park Piran Basti, Muridke, Sheikhupura, Punjab, Pakistan","7",,,,,,,"Q7X3+JJ8","33","Allah Hu Bakery","31.7990377","74.2540721","Bakery",,"3.5"
"R726+PR3, Mohalla Sharif Park, Muridke, Sheikhupura, Punjab, Pakistan","8",,,,,,,"R726+PR3","13","Ali Sweets And Bakers","31.8018161","74.2620878","Bakery",,"3.9"
"H79P+GV7, Outfall Rd, St Nagar, Lahore, Punjab 54000, Pakistan","10",,,,,,"54000","H79P+GV7, Outfall Rd","37","Paradise Bakers","31.5687916","74.2871583","Bakery",,"4.5"
"34 Nabha road, Old Anarkali Rd, Dhobi Mandi Lahore, Punjab 54000, Pakistan","11",,,,,,"54000","34 Nabha road, Old Anarkali Rd","122","Al Majeed Bakers","31.5652345","74.3097238","Bakery",,"4.5"
"J839+95P, Abu Bakar Rd, Badami Bagh, Lahore, Punjab, Pakistan","12",,,,,,,"J839+95P, Abu Bakar Rd","377","Gourmet Foods","31.6034642","74.3179396","Bakery",,"4.1"
"R753+RC2, Main GT Rd, Mohalla Sheikhan Muridke, Sheikhupura, Punjab 39000, Pakistan","13",,,,,,"39000","R753+RC2, Main GT Rd","9","Mujahid sweets and bakers","31.8035222","74.2547118","Bakery",,"3.7"
"Purana, Old Narowal Rd, Peoples Colony, Muridke, Sheikhupura, Punjab, Pakistan","14",,,,,,,"Purana, Old Narowal Rd","8","Super A One Bakers","31.8110781","74.2709963","Bakery",,"5"
"Sher Shah Rd, New Shad Bagh, Lahore, Punjab 54000, Pakistan","15",,,,,,"54000","Sher Shah Rd","655","Cakes & Bakes","31.5976006","74.3419778","Bakery",,"4.3"
"Street 2, Faisal Park Barkat town Stop Shahdara, Lahore, 54950, Pakistan","16",,,,,,"54950","Street 2, Faisal Park Barkat town Stop Shahdara","107","Cake Marque Cakes And Cupcakes. Online Cake Order in Lahore.","31.6414667","74.2825552","Cupcake shop",,"5"
"122 GT Rd, opp. Telephone Exchange, Baghbanpura, Lahore, Punjab 54000, Pakistan","17",,,,,,"54000","122 GT Rd, opp. Telephone Exchange","359","Fazal Sweets & Bakers","31.5796523","74.370526","Bakery","$$","4.3"
"H8C6+4J3, Anarkali Bazaar Lahore, Punjab 54000, Pakistan","18",,,,,,"54000","H8C6+4J3","180","S Mohkam-Ud-Din and Sons Bakers & Wedding Cakes","31.5702656","74.3115617","Bakery",,"4.5"
"HFJ8+3G2, Lahore Medical Housing Society, Lahore, Punjab, Pakistan","19",,,,,,,"HFJ8+3G2","35","Butt Sweets & Bakers","31.5801327","74.4662614","Bakery","$$","4"
"Chota Mufti Baqar Walled City of Lahore, Lahore, Punjab 54000, Pakistan","20",,,,,,,,"84","Kashmir Bakers & Khatai Shop (Mochi Gate)","31.5819607","74.3228206","Bakery","$$","4.3"
"Lahore wala adda, Halla Chowk, Multan Rd, Pattoki, Kasur, Punjab, Pakistan","2",,,,,,,"Lahore wala adda, Halla Chowk, Multan Rd","316","Paradise Sweets & Bakers پیراڈائیز سویٹس اینڈ بیکرز","31.0246793","73.8473788","Bakery",,"4.1"
"By Pass, Bara Ghar, Nankana Sahib, Punjab, Pakistan","3",,,,,,,"By Pass","1","Ravi Sweet & Bakers Bara Ghar","31.2201732","73.6324577","Bakery",,"5"
"Jaranwala Road Sayedwala Nankan Sahab, Syed Wala, Nankana Sahib, Punjab, Pakistan","4",,,,,,,"Jaranwala Road Sayedwala Nankan Sahab","329","Lahore Sweets & Bakers","31.1437932","73.4952069","Bakery",,"4"
"95CP+G62, Sector C Commercial Area Sector C Bahria Town, Lahore, Punjab 53720, Pakistan","10",,,,,,"53720","95CP+G62","837","Bundu Khan Sweets & Bakers - Bahria Town","31.3712595","74.1855055","Bakery","$$","4.3"
"Plaza no 01 G/F, jinnah Block, Rafi Block Bahria Town, Lahore, Punjab, Pakistan","17",,,,,,,"Plaza no 01 G/F, jinnah Block","38","Ramzan Mart & Bakers","31.3657107","74.1927503","Bakery",,"4.5"
"29, Commercial Area, Shams Ave, Block B Canal Gardens, Lahore, Punjab, Pakistan","19",,,,,,,"29, Commercial Area, Shams Ave","98","Malva Bakers and Sweets","31.393571","74.1751888","Bakery",,"3.9"
"4FC3+PGP, Shehbaz Rd, Kasur, Punjab, Tariq Colony, Kasur, Punjab, Pakistan","1",,,,,,,"4FC3+PGP, Shehbaz Rd, Kasur, Punjab","80","Lahore Bakers & Sweets","31.1218268","74.4538354","Bakery","$$","4"
"DR. BASHIR WALI STREET OUTSIDE, near DERA SHAMLAAT, Kot Murad Khan Kasur, 55050, Pakistan","2",,,,,,"55050","DR. BASHIR WALI STREET OUTSIDE, near DERA SHAMLAAT","50","Nawab Bakers","31.1131121","74.4415711","Bakery",,"4.1"
"Main Pero Waala Road, Kasur, Punjab 55361, Pakistan","3",,,,,,"55361","Main Pero Waala Road","45","Al Khalil Bakers And Sweets","31.1326607","74.463821","Bakery",,"4.1"
"4FC4+R4X, Shahbaz Khan Rd, Tariq Colony Munir Shaheed Colony, Kasur, Punjab, Pakistan","4",,,,,,,"4FC4+R4X, Shahbaz Khan Rd","9","Bundu Khan","31.1221109","74.4553845","Bakery","$$","4"
"out side Ellite College, Main Shahbaz Khan Rd, Kasur, Punjab, Pakistan","5",,,,,,,"out side Ellite College, Main Shahbaz Khan Rd","2","Top Cake Club","31.1225258","74.4623501","Bakery",,"3"
"Shahbaz Khan Rd, Tariq Colony Munir Shaheed Colony, Kasur, Punjab, Pakistan","6",,,,,,,"Shahbaz Khan Rd","496","Cakes & Bakes","31.1219367","74.4537963","Bakery","$$","4.3"
"4F93+V8V, Nasim Hayat Rd, Baldia Chowk, Kot Bahadur Khan, Noor Masjid Rd, Tariq Colony, Kasur, Punjab 55050, Pakistan","7",,,,,,"55050","4F93+V8V, Nasim Hayat Rd, Baldia Chowk, Kot Bahadur Khan, Noor Masjid Rd","272","Al-Khalil Bakers","31.1197437","74.4532919","Bakery",,"4"
"89GJ+X5P, Block A Central Park Housing Scheme, Lahore, Punjab, Pakistan","11",,,,,,,"89GJ+X5P","180","Ameer & Son's Bakery","31.3274625","74.3804531","Bakery",,"4"
"87HJ+W9C, Jia Bagga, Lahore, Punjab, Pakistan","13",,,,,,,"87HJ+W9C","27","The Angel Bakery's","31.3298081","74.2809025","Bakery",,"4.6"
"Block m2a, Lake City, Lahore, Pakistan","14",,,,,,,"Block m2a","91","Iqwee's Bakery","31.3667364","74.249908","Bakery",,"4.1"
"99H6+RPH, Main road, Faisal Town Rd, Kahna Nau, Lahore, Punjab, Pakistan","16",,,,,,,"99H6+RPH, Main road, Faisal Town Rd","4","Emmar Mart and Bakers","31.3795534","74.361864","Bakery",,"4.5"
"Deen da toll, Madhodas, Mandi Faizabad, 00000, Pakistan","21",,,,,,"00000","Deen da toll","0","Baking valley house","31.3909078","73.954441","Bakery",,
"83A, Block B1 Ghalib Market Gulberg III, Lahore, Punjab 54000, Pakistan","1",,,,,,"54000","83A","40","Makes Bakery","31.5131754","74.3534304","Bakery",,"4.9"
"Service Rd, Rehmanpura, Sheikhupura, Punjab, Pakistan","3",,,,,,,"Service Rd","215","Alam Sweets & Bakers","31.7071751","74.0075222","Bakery","$$","4.2"
,"4",,,,,,,,"1","Baking Memories","31.4829403","74.3343893","Bakery",,"5"
"P245+Q3X, Service Rd, Rehmanpura, Sheikhupura, Punjab, Pakistan","5",,,,,,,"P245+Q3X, Service Rd","492","Gourmet Foods","31.7069775","74.0077415","Bakery",,"3.9"
"PX6P+CWQ Regal Chowk, Lahore - Sargodha Rd, Mohalla Ahmedpura, Sheikhupura, Punjab, Pakistan","6",,,,,,,"PX6P+CWQ Regal Chowk, Lahore - Sargodha Rd","978","Gourmet Foods","31.7110922","73.9873476","Bakery","$$","4"
"H6V7+24J, Unnamed Road, Kot Nur Sha, Sheikhupura, Punjab, Pakistan","8",,,,,,,"H6V7+24J, Unnamed Road","34","Doce Bakeries","31.5925884","74.2127553","Bakery",,"4"
"PRXG+HVX, Lahore - Sargodha Rd, Islampura, Farooqabad, Sheikhupura, Punjab, Pakistan","6",,,,,,,"PRXG+HVX, Lahore - Sargodha Rd","262","Gourmet Sweets & Bakers Farooqabad","31.7489894","73.8272215","Bakery",,"3.9"
"RJMC+2C4, Lahore Rd, Khanqah Dogran, Nankana Sahib, Punjab, Pakistan","7",,,,,,,"RJMC+2C4, Lahore Rd","340","Gourmet Bakers & Sweets","31.8325162","73.6210719","Bakery",,"3.9"
"Shabbashtan Chownk, Bhikhi Rd, city, Sheikhupura, Punjab 39345, Pakistan","15",,,,,,"39345","Shabbashtan Chownk, Bhikhi Rd","3","Cake Home Bakers & Sweets","31.7023937","73.9825893","Bakery",,"4.3"
"99G8+54X, Kahna Nau, Kahna, Lahore, Punjab, Pakistan","4",,,,,,,"99G8+54X","341","Bundu Khan","31.3754905","74.3653626","Bakery","$$","4.3"
"89HM+5GW, Central Park Housing Scheme, Lahore, Punjab, Pakistan","5",,,,,,,"89HM+5GW","116","Bundu Khan Sweets & Bakers","31.3279758","74.383815","Bakery",,"4.4"
"66QJ+32C, Raiwind Rd, Raiwind, Lahore, Kasur, Punjab, Pakistan","2",,,,,,,"66QJ+32C, Raiwind Rd","95","Madni Sweets & Baker's","31.2376802","74.2300262","Bakery",,"4.2"
"C936+9F3, Lahore – Kasur Rd, Satellite Town, Lahore, Punjab 54000, Pakistan","9",,,,,,"54000","C936+9F3, Lahore – Kasur Rd","1005","Butt Sweets & Bakers","31.403397","74.3611671","Bakery",,"4"
"Block P1 Block P 1 Valencia, Lahore, Punjab, Pakistan","11",,,,,,,,"1724","Cakes & Bakes","31.3943489","74.2553419","Bakery","$$","4.2"
"54C4+CGH، Main Bazar، near Canal Bank, Kot Radha Kishan, Kasur, Punjab 55180, Pakistan","9",,,,,,"55180","54C4+CGH، Main Bazar، near Canal Bank","287","Punjab Sweets And Bakers.","31.1695494","74.100587","Bakery",,"4"
"7C59+464, Service Road, Mustafa Abad, Kasur, Punjab, Pakistan","10",,,,,,,"7C59+464, Service Road","58","Nice Bakers and sweet","31.2577726","74.4180783","Bakery",,"4.1"
"C786+HCJ, Block A1 Block A 1 Valencia, Lahore, Punjab 54770, Pakistan","12",,,,,,"54770","C786+HCJ","1556","Gourmet Bakery - Valencia Town","31.4166959","74.2609688","Bakery","$$","3.8"
"E Block, Youhanabad, Lahore, Punjab 54000, Pakistan","13",,,,,,"54000","E Block","10","KnicKnack","31.4119291","74.3661121","Bakery",,"4.7"
"111 Chenab Ave, WAPDA Town Block F 2 Wapda Town Phase 1 Lahore, Punjab 54000, Pakistan","14",,,,,,"54000","111 Chenab Ave","5","Roshows Bakehouse","31.4363418","74.2647331","Bakery",,"5"
"146-B, main College Road, Block B PCSIR Staff Colony, Lahore, Punjab 54770, Pakistan","15",,,,,,"54770","146-B, main College Road","902","Bevro Bakery Cafe","31.4303605","74.2878613","Bakery",,"4.3"
"Block K3 Block K 3 Wapda Town Phase 1 Lahore, Punjab, Pakistan","16",,,,,,,,"15","SweetLic cakes","31.4208125","74.2609375","Bakery",,"4.6"
"C9P5+7G3, Salman Park, Lahore, Punjab, Pakistan","17",,,,,,,"C9P5+7G3","53","NICE BAKERS AND SWEET","31.4356299","74.3588084","Bakery",,"4.3"
"1153 Street 44, Block M 3 A Lake City, Lahore, Punjab, Pakistan","18",,,,,,,"1153 Street 44","537","Bundu Khan Sweets & Bakers - Lake City","31.3691294","74.2549","Bakery","$$","4.3"
"49c PIA Main Boulevard, Block C Block C 1 Phase 1 Johar Town, Lahore, Punjab 54770, Pakistan","19",,,,,,"54770","49c PIA Main Boulevard","76","Ciasto baker","31.4480315","74.2811726","Bakery",,"4.3"
"2VR6+FX4, Multan Lahore Rd, Narroki Mahja Pattoki, Kasur, Punjab, Pakistan","9",,,,,,,"2VR6+FX4, Multan Lahore Rd","533","Jawa Sweets & Bakers (Jawa Fooding)","31.0410973","73.8624821","Bakery","$$","4.2"
"2VF3+36V, Allama Iqbal Rd, opposite MCB Bank, Pattoki, Kasur, Punjab, Pakistan","17",,,,,,,"2VF3+36V, Allama Iqbal Rd, opposite MCB Bank","160","New White Sweets and Bakers","31.0227352","73.8530394","Bakery",,"4"
"9732+JM6, Lake city mall, Lake City Roundabout, Block M 1 Lake City, Lahore, 54000, Pakistan","4",,,,,,"54000","9732+JM6, Lake city mall, Lake City Roundabout","10","Meemus Kitchen","31.35406","74.2516447","Bakery",,"3.6"
"66H3+73G, Raiwind, Lahore, Punjab, Pakistan","5",,,,,,,"66H3+73G","1","Haider bakeries and jurnal store","31.2281998","74.2026903","Store",,"5"
"F632+PR5, River Edge Housing Scheme, Topaz Block Park View, Lahore, Punjab, Pakistan","3",,,,,,,"F632+PR5, River Edge Housing Scheme","4","Malva sweets and bakers","31.4542625","74.2021094","Bakery",,"4.5"
"67-Topaz, Vfixall, Block, Park View City Lahore Topaz Block Topaz, Lahore, Punjab, Pakistan","4",,,,,,,"67-Topaz, Vfixall, Block","1","Cake Bakery","31.4542882","74.2021506","Bakery",,"4"
"Shop# 1, Main Canal Bank Road, Just of EME, near Total Petroleum, Muhafiz Town, Lahore, Punjab, Pakistan","6",,,,,,,"Shop# 1, Main Canal Bank Road, Just of EME, near Total Petroleum","1246","Kitchen Cuisine - EME","31.455331","74.2169575","Bakery","$$$","4.3"
"6, Raiwind Rd, Ali Town Lahore, Punjab 54000, Pakistan","7",,,,,,"54000","6, Raiwind Rd","1414","Bundu Khan Sweets & Bakers - Raiwind Road","31.4620205","74.244516","Bakery","$$","4.3"
"F67W+PMF, Ali Town Lahore, Punjab, Pakistan","8",,,,,,,"F67W+PMF","21","Al ameer bakery","31.4643034","74.2466718","Bakery",,"4.4"
"123 Abdul Haque Rd, Block L Johar Town, Lahore, Punjab 54000, Pakistan","10",,,,,,"54000","123 Abdul Haque Rd","1053","Mini Treats","31.4679373","74.2673534","Cake shop","$$$","4.3"
"126-B, Block B Judicial Colony, Lahore, Punjab 54000, Pakistan","11",,,,,,"54000","126-B","19","United Bakery","31.4677094","74.2434594","Bakery",,"4"
"G752+FW9, 80 feet road, Maraghzar Colony Saman Zar Colony sabzazar, Lahore, Punjab, Pakistan","12",,,,,,,"G752+FW9, 80 feet road","39","Laraib Bakers and sweets","31.508672","74.2523723","Bakery",,"4.1"
"Architect Ave, K Block Block K Architects Engineers Housing Society, Lahore, Punjab, Pakistan","13",,,,,,,"Architect Ave","334","Malva Bakers & Sweets","31.4437003","74.2576591","Bakery",,"4.2"
