"location/lat","location/lng","address","postalCode","title","reviewsCount","reviewsDistribution/fiveStar","reviewsDistribution/fourStar","reviewsDistribution/oneStar","reviewsDistribution/threeStar","reviewsDistribution/twoStar","categoryName","hotelStars","street","price","totalScore"
"31.7132053","73.9797033","مرکزی جامع مسجد, Civil Lines, Sheikhupura, Punjab, Pakistan",,"Zahoor Carpets Skp","14","7","4","1","1","1","Shopping mall",,"مرکزی جامع مسجد",,"4.1"
"31.7095568","73.9812103","14/2 Civil Quarters Rd, Allama Iqbal Park, Sheikhupura, Punjab 39350, Pakistan","39350","Metro shoes","8","2","2","1","2","1","Shopping mall",,"14/2 Civil Quarters Rd",,"3.4"
"31.7048439","73.9690634","PX39+WJP, Ghang Road, Sheikhupura, Punjab, Pakistan",,"MD24 Shopping","0",,,,,,"Shopping mall",,"PX39+WJP, Ghang Road",,
"31.6950633","73.9839598","13 km Lhr skp Rd, Lahore - Sheikhupura - Faisalabad Rd, Kot Kalyaran, Sheikhupura, Punjab 12345, Pakistan","12345","Kalyar Shopping Complex site","0",,,,,,"Shopping mall",,"13 km Lhr skp Rd, Lahore - Sheikhupura - Faisalabad Rd",,
"31.7106848","73.9812477","PX6J+7FH, Civil Quarters Rd, Jinnah Park, Sheikhupura, Punjab, Pakistan",,"Pace Garments sheikhupura","2","1","0","1","0","0","Shopping mall",,"PX6J+7FH, Civil Quarters Rd",,"3"
"31.7125466","73.9817227","PX7J+2M9, Gali Kakay zaaya،, Sheikhupura, Punjab, Pakistan",,"IB sons makeup studio","2","2","0","0","0","0","Shopping mall",,"PX7J+2M9, Gali Kakay zaaya،",,"5"
"31.3528705","74.4910108","9F3R+4CR, Bedian Rd, Lahore, Kasur, Punjab, Pakistan",,"Sandhu Chok Lakhoki Stop","27","17","5","2","3","0","Market",,"9F3R+4CR, Bedian Rd",,"4.3"
"31.3582282","74.5305935","9G5J+76W, Jahman village, Badian road, Jahman, Lahore, Punjab, Pakistan",,"Abdullah garminnts and cosmetics","0",,,,,,"Shopping mall",,"9G5J+76W, Jahman village, Badian road",,
"31.6859732","73.8434065","MRPV+C9, Buttar, Sheikhupura, Punjab, Pakistan",,"Abdul Rehman Shop","1",,,,,,"Shopping mall",,"MRPV+C9",,"5"
"31.5861887","74.3197959","H8P9+FWF, Chunna Mandi Bazar, Katri Bawa Walled City of Lahore, Lahore, Punjab, Pakistan",,"UK Center","1071",,,,,,"Shopping mall",,"H8P9+FWF, Chunna Mandi Bazar",,"4.4"
"31.7418314","73.8315628","Railway Rd, Farooqabad, Sheikhupura, Punjab 39500, Pakistan","39500","Hyper Shopping Mall","10",,,,,,"Shopping mall",,"Railway Rd",,"3.6"
"31.7403797","73.8291657","near Alflah Bank, Farooqabad, Sheikhupura, Punjab, Pakistan",,"Zam Zam mall","6",,,,,,"Shopping mall",,"near Alflah Bank",,"3.2"
"31.7395561","73.829855","PRQH+RWH, melaad chowk road Farooqabad, Farooqabad, Sheikhupura, Punjab, Pakistan",,"Family Mart","171",,,,,,"Shopping mall",,"PRQH+RWH, melaad chowk road Farooqabad",,"3.8"
"31.7409166","73.8298487","ABC Retailing, Farooqabad, Sheikhupura, Punjab, Pakistan",,"Ali Baba Center Farooqabad","196",,,,,,"Shopping mall",,"ABC Retailing",,"4"
"31.7420548","73.8302646","PRRJ+R4C, Farooqabad, Sheikhupura, Punjab, Pakistan",,"Jameel Rafique karyana Karyana Store","1",,,,,,"Shopping mall",,"PRRJ+R4C",,"5"
"31.7028931","74.0183895","P239+592, Bypass, Khan Colony, Sheikhupura, Punjab, Pakistan",,"Center Point","60",,,,,,"Shopping mall",,"P239+592, Bypass",,"4.1"
"31.7444811","73.8665011","PVV8+QJR, Jhaamkay, Sheikhupura, Punjab, Pakistan",,"Rahamat Machi Shop","4",,,,,,"Shopping mall",,"PVV8+QJR",,"4.5"
"31.7105991","73.9738419","Civil, Shami Rd, line, Sheikhupura, Punjab, Pakistan",,"Xxxxccxxxxxxxx","1","0","1","0","0","0","Shopping mall",,"Civil, Shami Rd",,"4"
"31.6913763","73.9734689","چونگی سٹاپ, طاہر مغل ڈائی میکر, Faisalabad Rd, Sheikhupura, Punjab, Pakistan",,"طاہر مغل ڈائی میکر","0",,,,,,"Shopping mall",,"چونگی سٹاپ, طاہر مغل ڈائی میکر, Faisalabad Rd",,
"31.7118867","73.9822277","Lahore - Sargodha Rd, Ghauri Chowk Allama Iqbal Park, Sheikhupura, Punjab 39350, Pakistan","39350","HH FABRICS","7","4","1","0","1","1","Shopping mall",,"Lahore - Sargodha Rd",,"4.1"
"31.6969649","73.9769594","Bhikhi Rd, Sheikhupura, Punjab, Pakistan",,"Al Madina Paint House","2","0","0","0","2","0","Shopping mall",,"Bhikhi Rd",,"3"
"31.710017","73.9813078","PX6J+2G3, Allama Iqbal Park, Sheikhupura, Punjab, Pakistan",,"SFC IQBAL PARK MARKET SHEIKHUPURA","0",,,,,,"Shopping mall",,"PX6J+2G3",,
"31.7123006","73.9820304","Hamayon Bazar, Sheikhupura, Punjab 39350, Pakistan","39350","Chand Jewellers","10","8","1","1","0","0","Shopping mall",,"Hamayon Bazar",,"4.5"
"31.7121806","73.9826128","Gali Zargaran, Sheikhupura, Punjab, Pakistan",,"Sheikh Khussa Mahal","6","3","0","1","1","1","Shopping mall",,"Gali Zargaran",,"3.5"
"31.7104534","73.9812002","color kids Civl، Qutar road, Jinnah Park, Sheikhupura, Punjab 39350, Pakistan","39350","color kids & Shopping Center","0",,,,,,"Shopping mall",,"color kids Civl، Qutar road",,
"31.6779951","73.9720592","Shaeen villas, phase-2 Sheikhupura, Punjab 39350, Pakistan","39350","Buyoujoy","0",,,,,,"Shopping mall",,"Shaeen villas",,
"31.7044178","73.9680117","Ghang road street, 7 None, Sheikhupura, 00000, Pakistan","00000","LS seller","0",,,,,,"Shopping mall",,"Ghang road street, 7 None",,
"31.7133097","73.9817914","Sheikhupura, Punjab, Pakistan",,"fancy gift center","0",,,,,,"Shopping mall",,,,
"31.7184419","73.9839123","PX9M+9HF, Jandiala - Sheikhupura Rd, Sheikhupura, Punjab, Pakistan",,"All_mujahid kariana store","0",,,,,,"Shopping mall",,"PX9M+9HF, Jandiala - Sheikhupura Rd",,
"31.7078614","73.9742092","shop 98 Stadium, Sheikhupura, Punjab, Pakistan",,"AA secure CCTV cameras and electric solution","7","6","0","1","0","0","Shopping mall",,"shop 98 Stadium",,"4.4"
"31.7313638","73.9034688","PWJ3+G9X, Lahore - Sargodha Rd, Machikay, Sheikhupura, Punjab, Pakistan",,"Asif Janrall Store","0",,,,,,"Shopping mall",,"PWJ3+G9X, Lahore - Sargodha Rd",,
"31.710846","73.9812592","14/2 Civil Quarters Rd, Jinnah Park, Sheikhupura, Punjab 39350, Pakistan","39350","Persona Garments","1","0","1","0","0","0","Shopping mall",,"14/2 Civil Quarters Rd",,"4"
"31.7213622","73.9247927","Sargodha Bypass, Ghazi Minara, Sheikhupura, Punjab 54000, Pakistan","54000","Cattle Market, Sheikhupura","322","171","68","14","59","10","Cattle market",,"Sargodha Bypass",,"4.2"
"31.7091104","73.9827088","Allama Iqbal Park, Sheikhupura, Punjab 39350, Pakistan","39350","Rainbow Cash & Carry - Sheikhupura","215","97","58","16","37","7","Supermarket",,,,"4"
"31.7092755","73.9793298","Government Quarters Jinnah Park, Sheikhupura, Punjab 39350, Pakistan","39350","Buyoujoy","0",,,,,,"Shopping mall",,,,
"31.6982128","73.974981","MXXF+7XQ, Khalid Rd, Sheikhupura, Punjab, Pakistan",,"Shafiq Ata Chakki","0",,,,,,"Shopping mall",,"MXXF+7XQ, Khalid Rd",,
"30.7592259","74.1213803","Q45C+MGG, Kanganpur, Kasur, Punjab, Pakistan",,"Arif shopping centre kangan pur","7",,,,,,"Shopping mall",,"Q45C+MGG",,"4.9"
"31.7103849","73.9810449","PX6J+59V Makkah Tower, Civil Quarters Rd, Allama Iqbal Park, Sheikhupura, Punjab, Pakistan",,"Best Holidays Inn","261","125","58","24","40","14","Hotel","3-star hotel","PX6J+59V Makkah Tower, Civil Quarters Rd",,"3.9"
"31.5635009","74.347653","Main Bazar, 24 Mughalpura Rd, Garhi Shahu, Lahore, 54000, Pakistan","54000","Ashraf mall","626","318","135","33","106","34","Shopping mall",,"Main Bazar, 24 Mughalpura Rd",,"4.1"
"31.5606363","74.3215758","H86C+7J4, Mall Rd, Mozang Chungi, Lahore, Punjab 54000, Pakistan","54000","Naqi Market","1008","447","262","54","183","62","Shopping mall",,"H86C+7J4, Mall Rd",,"4"
"31.5745432","74.3871467","Shalimar Hospital Ave, Sahowari Ramgarh, Lahore, Punjab 54600, Pakistan","54600","The Lounze","26","25","1","0","0","0","Shopping mall",,"Shalimar Hospital Ave",,"5"
"31.5701186","74.3117915","Nila Gumbad Rd, Anarkali Bazaar Lahore, Punjab 54000, Pakistan","54000","Riazuddin Shopping Center","249","104","63","20","47","15","Shopping mall",,"Nila Gumbad Rd",,"3.9"
"31.5639702","74.3176418","Hall road, road, qazi center Mall, Lahore, 54000, Pakistan","54000","Welltech Electronics","545","277","74","31","124","39","Shopping mall",,"Hall road, road",,"4"
"31.5633181","74.3485299","H87X+8CC, Burni Rd, Garhi Shahu, Lahore, Punjab 54000, Pakistan","54000","Good Luck Bakers & Shopping Mall","87","40","16","6","21","4","Shopping mall",,"H87X+8CC, Burni Rd",,"3.9"
"31.587594","73.6723158","15 Km Lahore - Sheikhupura - Faisalabad Rd, Lahore, Sheikhupura, Punjab 54000, Pakistan","54000","Factory Outlet Mall","3",,,,,,"Shopping mall",,"15 Km Lahore - Sheikhupura - Faisalabad Rd",,"4.3"
"31.5638833","74.348048","H87X+H63، مغلپورہ روڈ, Garhi Shahu, Lahore, Punjab, Pakistan",,"Garhi Shahu Market","624","388","112","23","80","21","Shopping mall",,"H87X+H63، مغلپورہ روڈ",,"4.3"
"31.514118","73.6251059","Chak #4 G.B, Nankana Sahib, Punjab, Pakistan",,"بوٹا جنرل سٹور","12",,,,,,"Shopping mall",,"Chak #4 G.B",,"4.5"
"31.5688943","74.3105622","H896+H63, Anarkali Bazaar Lahore, Punjab 54000, Pakistan","54000","Lahore Stationary","22","13","5","0","3","1","Shopping mall",,"H896+H63",,"4.4"
"31.5717132","74.3124981","H8C7+Q29, Dhani Ram Rd, Anarkali Bazaar Civil Lines, Lahore, Punjab 54000, Pakistan","54000","Fajar collection Anarkali Tower lahore","553","337","106","24","76","10","Shopping mall",,"H8C7+Q29, Dhani Ram Rd",,"4.3"
"31.5643223","73.6385981","HJ7Q+PCH, Unnamed Road, Lumb Wali, Sheikhupura, Punjab, Pakistan",,"Mian super store and traders","2",,,,,,"Shopping mall",,"HJ7Q+PCH, Unnamed Road",,"4.5"
"31.583986","73.7533486","HQM3+H8X, Taali Chak, Sheikhupura, Punjab, Pakistan",,"Feezanay Muhammad Sooper Store","4",,,,,,"Shopping mall",,"HQM3+H8X",,"5"
"31.5892364","73.6912183","HMQR+MFW Madni Electronics, Basement, Nankana Rd, Madina Colony, Mananwala, Sheikhupura, Punjab 39170, Pakistan","39170","BS Mart","7",,,,,,"Shopping mall",,"HMQR+MFW Madni Electronics, Basement, Nankana Rd",,"5"
"31.5916919","73.6927721","HMRV+M4C, Manawala - Farooq Abad Rd, Mananwala, Sheikhupura, Punjab, Pakistan",,"AlJaddah Plaza Mobile Market","11",,,,,,"Shopping mall",,"HMRV+M4C, Manawala - Farooq Abad Rd",,"4.3"
"31.5722649","73.4819002","HFCJ+WQ2, Shahkot, Nankana Sahib, Punjab, Pakistan",,"Hammad Shooping Centre","20",,,,,,"Shopping mall",,"HFCJ+WQ2",,"4.2"
"31.5634915","73.5719314","HH7C+9QV, Nathuwala, Nankana Sahib, Punjab, Pakistan",,"Alam General Store","19",,,,,,"Shopping mall",,"HH7C+9QV",,"4.5"
"31.6000083","73.6193937","JJ29+2Q2, Chak No. 175 R.B, Nankana Sahib, Punjab, Pakistan",,"Al Fateh Karyana Store","12",,,,,,"Shopping mall",,"JJ29+2Q2",,"4.3"
"31.5378241","73.8299977","GRQH+4XH, Road, Warburton, Nankana Sahib, Punjab, Pakistan",,"mian anwar makki walay karyana store","18",,,,,,"Shopping mall",,"GRQH+4XH, Road",,"4.4"
"31.5894876","73.6915357","Madina Colony, Manan Wala, Sheikhupura, Punjab, Pakistan",,"Bhatti Plaza","1",,,,,,"Shopping mall",,,,"4"
"30.8243149","74.2143138","R6F7+PPG, Kul, Kasur, Punjab, Pakistan",,"Ahmed Karyana Merchant","3","3","0","0","0","0","Shopping mall",,"R6F7+PPG",,"5"
"30.8250296","74.211821","R6G6+2P8, Unnamed Road, Kul, Kasur, Punjab, Pakistan",,"Hafiz Super Store Kul","6","3","0","2","1","0","Shopping mall",,"R6G6+2P8, Unnamed Road",,"3.3"
"31.7100186","73.9803432","PX6J+244 Super Road, Civil Quarters Rd, Jinnah Park, Sheikhupura, Punjab 39350, Pakistan","39350","Brand Center","2","2","0","0","0","0","Clothing store",,"PX6J+244 Super Road, Civil Quarters Rd",,"5"
"31.7133034","73.9817108","PX7J+8MG, Main Bazar, Sheikhupura, Punjab, Pakistan",,"madina baby gift canter","0",,,,,,"Shopping mall",,"PX7J+8MG, Main Bazar",,
"31.6990653","73.9800463","MXXJ+J2F Lasani street, Bhikhi Rd, Sheikhupura, Punjab, Pakistan",,"Pakistan Bait ul mall","9","4","1","1","3","0","Corporate office",,"MXXJ+J2F Lasani street, Bhikhi Rd",,"3.8"
"31.7092754","73.9793298","PX5H+PP8, near zee roll ice cream, Government Quarters Jinnah Park, Sheikhupura, Punjab, Pakistan",,"Khan Gee Bed Sheet Centre","0",,,,,,"Shopping mall",,"PX5H+PP8, near zee roll ice cream",,
"31.7131198","73.9809154","PX7J+69V, shajaha street, Main Bazar, Sheikhupura, Punjab, Pakistan",,"Zaheer cycle store skp","0",,,,,,"Shopping mall",,"PX7J+69V, shajaha street, Main Bazar",,
"31.5615513","74.3193379","65 Shahrah-e-Quaid-e-Azam, Mozang Chungi, Lahore, Punjab 54000, Pakistan","54000","HKB and Sons The Mall","56","18","14","6","15","3","Shopping mall",,"65 Shahrah-e-Quaid-e-Azam",,"3.6"
"31.7117785","73.9759437","Posh Mall, 3 College Road, near Domino's, Sheikhupura, Punjab 39350, Pakistan","39350","Posh Mall - Sheikhupura","0",,,,,,"Boutique",,"Posh Mall, 3 College Road, near Domino's",,
"31.7116995","73.9813628","Civil Quarters Rd, Jinnah Park, Sheikhupura, Punjab 39350, Pakistan","39350","AIZAY MALL","0",,,,,,"Women's clothing store",,"Civil Quarters Rd",,
"31.7133035","73.9815735","PX7J+8JG, Main Bazar, Sheikhupura, Punjab, Pakistan",,"Kids Key","1","1","0","0","0","0",,,"PX7J+8JG, Main Bazar",,"5"
"31.5626179","74.3403133","Durand Rd, Muhammad Nagar Garhi Shahu, Lahore, Punjab 54000, Pakistan","54000","Queen Plaza","660","303","142","44","128","43","Shopping mall",,"Durand Rd",,"3.9"
"31.7106158","73.981368","Allama Iqbal Park, Sheikhupura, Punjab, Pakistan",,"Panorama Garments & Dulha House","0",,,,,,"Shopping mall",,,,
"31.7128962","73.974371","PX7F+5P5, Sheikhupura, Punjab, Pakistan",,"Minnie Minors","9","5","1","2","0","1","Clothing store",,"PX7F+5P5",,"3.7"
"31.6001651","74.3030303","J823+366, Timber Market Qila Lachman Singh, Lahore, Punjab, Pakistan",,"SK Footwear","25","21","1","1","2","0","Outlet mall",,"J823+366",,"4.6"
"31.7051663","73.9730432","PX4F+367, Stadium Park Sheikhupura, Punjab, Pakistan",,"Pets Mall Online sheikhupura","5","2","0","3","0","0","Store",,"PX4F+367",,"2.6"
"31.5792468","74.3204829","Shop no.4, Sadaf Market, Peeple Vehra, Shalmi, Kucha Chagtah Walled City of Lahore, Lahore, Punjab 54000, Pakistan","54000","Sadaf Nageen Traders","23","19","1","1","2","0","Shopping mall",,"Shop no.4, Sadaf Market, Peeple Vehra, Shalmi",,"4.6"
"31.7222559","73.9668439","Changa Road, Rasoolpura, Sheikhupura, Punjab 39350, Pakistan","39350","میاں کریانہ سٹور ایزی منی ٹرانسفر اینڈ بلنگ پوائنٹ","0",,,,,,"Shopping mall",,"Changa Road",,
"31.7200682","73.9474431","near mega mall, Sultan Colony, Sheikhupura, Punjab, Pakistan",,"5Tani fish corner and grosery and chicken shop","1","1","0","0","0","0","Store",,"near mega mall",,"5"
"31.5618125","74.3218125","H86C+PPF, Garhi Shahu, Lahore, Punjab 54000, Pakistan","54000","Panorama Parking Complex","197","96","47","15","35","4","Shopping mall",,"H86C+PPF",,"4"
"31.5629318","74.3180087","H879+56C, Shahrah-e-Quaid-e-Azam Service Rd N, Garhi Shahu, Lahore, Punjab 54000, Pakistan","54000","Madina center","10","9","0","1","0","0","Shopping mall",,"H879+56C, Shahrah-e-Quaid-e-Azam Service Rd N",,"4.6"
"31.7098796","73.9806835","Jinnah Park, Sheikhupura, Punjab, Pakistan",,"Royal Kids Sheikhupura","15","12","2","0","1","0","Shopping mall",,,,"4.7"
"31.6160276","74.2775247","J78H+C26, Lahore - Sargodha Rd, Taragarh Shahdara Town, Lahore, Punjab, Pakistan",,"Step 2","13","11","0","0","2","0","Shopping mall",,"J78H+C26, Lahore - Sargodha Rd",,"4.7"
"31.5893581","74.2986389","H7QX+PFR, Karim Park Lahore, Punjab, Pakistan",,"ALI HAJVERI SHOPPING CENTRE","1","1","0","0","0","0","Shopping mall",,"H7QX+PFR",,"5"
"31.7094952","73.9810022","aizay mall, Civil quarter road jinah park ali shoping mall stylista by azeem fasion, Civil Quarters Rd, Sheikhupura, 39350, Pakistan","39350","STYLISTA READY TO WEAR AND AIZAY MALL CENTER","0",,,,,,"Garment exporter",,"aizay mall, Civil quarter road jinah park ali shoping mall stylista by azeem fasion, Civil Quarters Rd",,
"31.5823897","74.3284699","Naulakha, Lahore, Punjab 54000, Pakistan","54000","Daraz Office Lahore","142","84","19","24","11","4","Shopping mall",,,,"4"
"31.5827347","74.3740462","Pakistani Bazar, Baghbanpura, Lahore, 54000, Pakistan","54000","Madni Center","13","8","2","1","2","0","Shopping mall",,"Pakistani Bazar",,"4.2"
"31.5976696","74.3857955","H9XP+387 Manzuria Masjid, Janipura Lahore, Punjab, Pakistan",,"Khalid General Store.","98","49","14","10","13","12","Outlet mall",,"H9XP+387 Manzuria Masjid",,"3.8"
"31.59684","74.3182352","Pakistan-54600، 16 Grain Market Rd, Data Nagar Badami Bagh, Lahore, Punjab 54000, Pakistan","54000","Zapple","18","15","0","2","1","0","E-commerce service",,"Pakistan-54600، 16 Grain Market Rd",,"4.4"
"31.5795344","74.3201209","H8HC+R29, Shah Alam Mohalla Takia Sadhu markeet, Lahore, Punjab 54000, Pakistan","54000","Malik Abdul Razzaq Jewelry","55","38","9","1","6","1","Shopping mall",,"H8HC+R29",,"4.5"
"31.569817","74.3811636","H99J+WFF, Ramgarh Lahore, Punjab 54000, Pakistan","54000","Burj Al Saeed (Under Construction)","125","66","23","7","17","12","Shopping mall",,"H99J+WFF",,"4"
"31.5619096","74.320916","H86C+P8H ICON SHOPPING CENTRE, Shahrah-e-Quaid-e-Azam, Garhi Shahu, Lahore, Punjab 54000, Pakistan","54000","BRAND CITY SHOES ICON SHOPPING CENTRE MALL ROAD","2","1","0","0","1","0","Shopping mall",,"H86C+P8H ICON SHOPPING CENTRE, Shahrah-e-Quaid-e-Azam",,"4"
"31.6041792","74.3521433","J932+MVC, Bhagat Pura Bhagatpura, Lahore, Punjab, Pakistan",,"IQBAL STORE","5","4","1","0","0","0","Shopping mall",,"J932+MVC",,"4.8"
"31.5789617","74.3185708","H8H9+HCP, Shah Alam Mohalla Bela Nawab Sahib Walled City of Lahore, Lahore, Punjab 54000, Pakistan","54000","Aslam Purse House","27","16","7","1","1","2","Shopping mall",,"H8H9+HCP",,"4.3"
"31.6249447","73.5732557","JHFF+X8C, Wanotianwali, Nankana Sahib, Punjab, Pakistan",,"Nayyer Jarnalstore","7",,,,,,"Shopping mall",,"JHFF+X8C",,"4.6"
"31.5814152","74.3173445","Al mumtaz center rang mahal, Walled City of Lahore, Lahore, Punjab 54000, Pakistan","54000","Al Touheed Branch2","30","21","2","3","3","1","Shopping mall",,"Al mumtaz center rang mahal",,"4.2"
"31.5756514","74.3136823","New Anarkali Road, Anarkali Bazaar Lahore, Punjab 36121, Pakistan","36121","Shaheen Style Garments","2","2","0","0","0","0","Outlet mall",,"New Anarkali Road",,"5"
"31.6766457","73.5561753","Nawan Kot Chak 79 RB, Nankana Sahib, Punjab 39541, Pakistan","39541","نبیل کریانہ سٹور","0",,,,,,"Shopping mall",,,,
"31.7292404","73.5755307","PHHG+M6R, Dhaban Lalanwala Road, Safdarabad, Nankana Sahib, Punjab, Pakistan",,"Fine Shopping Centre","1",,,,,,"Shopping mall",,"PHHG+M6R, Dhaban Lalanwala Road",,"5"
"31.685919","73.4775217","MFPH+926, Ruryana, Nankana Sahib, Punjab, Pakistan",,"الاقصی سپر سٹور","2",,,,,,"Shopping mall",,"MFPH+926",,"4.5"
"31.5717002","73.483121","مسجد, کھجوروالی گلی،, Shahkot, Nankana Sahib, Punjab, Pakistan",,"New Family Shopping Centre","10",,,,,,"Shopping mall",,"مسجد, کھجوروالی گلی،",,"5"
"31.571962","73.4826091","Anarkali bazar ,Shahkot, Shahkot, Pakistan",,"Badshah Shopping Centre","3",,,,,,"Shopping mall",,"Anarkali bazar ,Shahkot",,"5"
"31.571788","73.4833459","HFCM+P89, Anarkali bazaar Shahkot, Nankana Sahib, Punjab, Pakistan",,"Sitara Shopping Center","23",,,,,,"Shopping mall",,"HFCM+P89",,"4.4"
"31.5704114","73.4848599","Noori Mosque Road, Shahkot, Nankana Sahib, Punjab, Pakistan",,"AMART","57",,,,,,"Shopping mall",,"Noori Mosque Road",,"3.9"
"31.5713847","73.4866738","Main Nankana Road, Shahkot, Nankana Sahib, Punjab, Pakistan",,"Tariq Mart Shahkot","94",,,,,,"Shopping mall",,"Main Nankana Road",,"4.2"
"31.1729448","73.8201528","5RFC+53C, Balloki - Halla Rd, Sarai Mughal, Kasur, Punjab, Pakistan",,"Ahmad Raza Janralstore","1",,,,,,"Shopping mall",,"5RFC+53C, Balloki - Halla Rd",,"5"
"31.1729445","73.8201356","5RFC+53C, Balloki - Halla Rd, Sarai Mughal, Kasur, Punjab, Pakistan",,"Hamza Cloth House","3",,,,,,"Shopping mall",,"5RFC+53C, Balloki - Halla Rd",,"4"
"31.2104792","73.890911","6V6R+59V Dayra adeel khan bhatti Dayra adeel khan bhatti, Phool Nagar, Phool, bagar 22034, Pakistan","22034","Dayra Adeel khan bhatti","1",,,,,,"Shopping mall",,"6V6R+59V Dayra adeel khan bhatti Dayra adeel khan bhatti",,"5"
"31.1683199","73.8116096","5R96+8JH, Balloki - Halla Rd, Sarai Mughal, Kasur, Punjab, Pakistan",,"Al Hakim pansar store","5",,,,,,"Shopping mall",,"5R96+8JH, Balloki - Halla Rd",,"4.4"
"31.5820703","74.3741936","H9JF+RMG, Baghbanpura, Lahore, Punjab 54000, Pakistan","54000","Shalimar Mall (Shoaib Malik)","5","3","1","0","0","1","Shopping mall",,"H9JF+RMG",,"4.2"
"31.1983294","73.905941","5WX4+89P, Phool Nagar, Kasur, Punjab, Pakistan",,"Shahadat Ali Karyana Stor شہادت علی","3",,,,,,"Shopping mall",,"5WX4+89P",,"4.7"
"31.5721397","74.3172349","H8C8+VV5, Gawalmandi, Lahore, Punjab 54000, Pakistan","54000","Dream Baby","25","10","7","1","7","0","Shopping mall",,"H8C8+VV5",,"4"
"31.6014497","74.3385081","Iqbal Rd, Shad Bagh, Lahore, Punjab 54000, Pakistan","54000","He & She Choice","6","5","0","0","1","0","Shopping mall",,"Iqbal Rd",,"4.7"
"31.5628888","74.3178944","Tetralink Technologies Site#01 Opp Dyal Singh Mansion Shahrah-e-Quaid-e-Azam, 45 The Mall، Lahore, 54000, Pakistan","54000","Tetralink Technologies","17","16","1","0","0","0","Outlet mall",,"Tetralink Technologies Site#01 Opp Dyal Singh Mansion Shahrah-e-Quaid-e-Azam, 45 The Mall",,"4.9"
"31.5665305","74.326921","H88G+JQ7, Montgomery Rd, Montgomery Park Qila Gujjar Singh, Lahore, Punjab 54000, Pakistan","54000","Hamza Centre","7","5","2","0","0","0","Shopping mall",,"H88G+JQ7, Montgomery Rd",,"4.7"
"31.7947584","73.7332704","QPVM+W82, Rachand, Sheikhupura, Punjab, Pakistan",,"سوداگر ہاوءس","5",,,,,,"Shopping mall",,"QPVM+W82",,"4.4"
"31.5626319","74.3278467","Ramada Hotel & Suites, ZEE Avenue Mall, 17-A Cooper Rd, Garhi Shahu, Lahore, Punjab 54000, Pakistan","54000","Zee Avenue","9","9","0","0","0","0","Shopping mall",,"Ramada Hotel & Suites, ZEE Avenue Mall, 17-A Cooper Rd",,"5"
"31.5842471","74.322998","Pakistan Market Azam Cloth Market, Lahore, 54000, Pakistan","54000","Baba Brothers Center, Fida Fabrics","33","18","7","1","4","3","Shopping mall",,"Pakistan Market Azam Cloth Market",,"4.2"
"31.8566192","73.7451796","Gajiana Nau - Ajniawala Rd, Gajiana nau, Sheikhupura, Punjab 39451, Pakistan","39451","Usman General Store - Gajiana Nau","15",,,,,,"Shopping mall",,"Gajiana Nau - Ajniawala Rd",,"4.1"
"31.584996","74.3748624","H9MF+XWX, Baghbanpura, Lahore, Punjab 54000, Pakistan","54000","Pakistan Mall","0",,,,,,"Shopping mall",,"H9MF+XWX",,
"31.7749146","73.7387805","QPFQ+XG6, Chota Sarkari, Sheikhupura, Punjab, Pakistan",,"بھٹی کریانہ سٹور","1",,,,,,"Shopping mall",,"QPFQ+XG6",,"5"
"31.5840078","74.3574401","Ghoray Shah Rd, Bhogiwal Kot Khawaja Saeed, Lahore, Punjab 54000, Pakistan","54000","Hameed City Center","27","15","4","1","5","2","Shopping mall",,"Ghoray Shah Rd",,"4.1"
"31.5627097","74.328147","& Punjab Assembly, Cooper Rd, off Shahrah-e-Quaid-e-Azam, opp. Faletti's Hotel, Garhi Shahu, Lahore, Punjab 54000, Pakistan","54000","Ramada Hotel & Suites And Zee Avenue Mall","154","115","20","6","10","3","Shopping mall",,"& Punjab Assembly, Cooper Rd, off Shahrah-e-Quaid-e-Azam, opp. Faletti's Hotel",,"4.5"
"31.5663338","74.2855158","Millat Rd, near av school, Sanda Islampura, Lahore, Punjab 54000, Pakistan","54000","CLASSIC OPTICS","29","16","4","1","7","1","Shopping mall",,"Millat Rd, near av school",,"4.1"
"31.5814677","74.3746448","Ghaas Mandi Stop, Main GT Rd, near Lahore, Baghbanpura, Lahore, Punjab 54920, Pakistan","54920","Daata Centre Shopping Mall","0",,,,,,"Shopping mall",,"Ghaas Mandi Stop, Main GT Rd, near Lahore",,
"31.5782926","74.3191984","H8H9+8M8, Mohalla Bela Nawab Sahib Walled City of Lahore, Lahore, Punjab 54000, Pakistan","54000","Japan Centre","7","3","2","0","1","1","Shopping mall",,"H8H9+8M8",,"4"
"31.5722782","74.3391665","H8CQ+WM7, Link Rd, Railway Colony Garhi Shahu, Lahore, Punjab, Pakistan",,"UMT Collection","1","1","0","0","0","0","Shopping mall",,"H8CQ+WM7, Link Rd",,"5"
"31.5641374","74.347972","H87X+P4V, Garhi Shahu Main Market Rd, Garhi Shahu, Lahore, Punjab, Pakistan",,"Malik market Ghari shahu","1","1","0","0","0","0","Shopping mall",,"H87X+P4V, Garhi Shahu Main Market Rd",,"5"
"31.5657613","74.2973456","38 Saadi Rd, Islampura, Lahore, Punjab 54000, Pakistan","54000","Asim khussa mahal","1","1","0","0","0","0","Shopping mall",,"38 Saadi Rd",,"5"
"31.5850525","74.3748903","H9PF+2XC, Rd Number 107, Baghbanpura, Lahore, Punjab 54000, Pakistan","54000","Baghban Pura","4","4","0","0","0","0","Shopping mall",,"H9PF+2XC, Rd Number 107",,"5"
"31.5848499","74.3721932","shop no13 mian arif market, Baghbanpura, Lahore, Punjab 54000, Pakistan","54000","Hameed And Sons Cosmetics And Ladies Bags","37","20","2","3","8","4","Shopping mall",,"shop no13 mian arif market",,"3.9"
"31.5926558","74.3425805","H8VV+328, Makhan Pura Chah Miran, Lahore, Punjab, Pakistan",,"Waseem Sardar","5","4","0","0","0","1","Shopping mall",,"H8VV+328",,"4.4"
"31.6424494","73.5435601","JGRV+XCF, Islam Nagar 81 RB, Nankana Sahib, Punjab, Pakistan",,"Nakshbndi Jenral Store","1","0","0","1","0","0","Shopping mall",,"JGRV+XCF",,"1"
"31.2004095","73.9159406","6W28+598, Head Balloki Road, Phool Nagar, Kasur, Punjab, Pakistan",,"Al Badar Tuck shop","1","1","0","0","0","0","Shopping mall",,"6W28+598, Head Balloki Road",,"5"
"31.5710588","74.331461","16B, 59, Omar Market McLeod Rd, Garhi Shahu, Lahore, Punjab 54000, Pakistan","54000","Zaheer Saeed Autos","26","12","0","1","7","6","Shopping mall",,"16B, 59, Omar Market McLeod Rd",,"3.6"
"31.5795932","74.3010549","H8H2+RCM, Bilal Ganj Lahore, Punjab 54000, Pakistan","54000","Usttad Paa Manna Sons Oldparts Delar Billalgunj","1","1","0","0","0","0","Shopping mall",,"H8H2+RCM",,"5"
"31.593873","74.2971532","H7VW+GVR, Karim Park Lahore, Punjab, Pakistan",,"ZMH Trading Co","21","17","0","0","3","1","Shopping mall",,"H7VW+GVR",,"4.6"
"31.5810458","74.3192163","H8J9+CM8, Shah Alam Walled City of Lahore, Lahore, Punjab 54000, Pakistan","54000","Sadiq cap house","5","4","0","1","0","0","Outlet mall",,"H8J9+CM8",,"4.2"
